"accession","title","year","file_count","Status", "Notes"
PXD017052,"Rapid, Deep and Precise Profiling of the Plasma Proteome with Multi-Nanoparticle Protein Corona",2020.0,6763, Analyzed,Plasma
PXD002815,A human interactome in three quantitative dimensions organized by stoichiometries and abundances,2015.0,4311,To be annotated, Interactions
PXD005336,Target Landscape of Clinical Kinase Inhibitors,2017.0,3071, To be annotated, Kinase Proteome
PXD013615,ATLANTIC: Activity landscapes of tumor cell lines determine drug responses,2019.0,2789, To be annotated, Drug response
PXD029009,A proteomic survival predictor for COVID-19 patients in intensive care,2021.0,2378, To be annotated, Plasma|Covid
PXD015087,High-flow chromatography for reproducible and high-throughput quantification of proteomes,2019.0,2368
PXD020191,Human Lung cancer proteomics and proteogenomics LC/MS&MS,2020.0,2330, To be annotated, Interactions
PXD025829,A Proteome-Wide Atlas of Lysine-Reactive Chemistry,2021.0,2215, To be annotated, Interactions
PXD000561,A draft map of the human proteome,2014.0,2212, Analyzed, Tissue proteome
PXD030983,Mass spectrometry-based draft of the mouse proteome,2022.0,2207, To be annotated, Tissue Mouse Proteome
PXD010899,Plasma Hirief -  In-depth human plasma proteome analysis captures tissue proteins and transfer of protein variants across the placenta,2018.0,2097, Analyzed, Plasma
PXD037285,Decrypting drug actions and protein modifications by dose- and time-resolved chemical proteomics,2022.0,2082, To be annotated, Drug response
PXD021013,ProteomeTools – Part III - HLA Class I & II & non-tryptic peptides,2020.0,1865, To be annotated, Synthetic data
PXD010154,A deep proteome and transcriptome abundance atlas of 29 healthy human tissues,2019.0,1809, Analyzed, Tissue proteome
PXD039023,Ely study plasma proteomics analysis,2022.0,1772, To be annotated, Plasma
PXD023090,Proteogenomic pathogenesis and classification of acute myeloid leukemia,2020.0,1771,To be annotated, Tumor data
PXD030598,Data independent acquisition mass spectrometry in severe Rheumatic Heart Disease (RHD) identifies a proteomic signature showing ongoing inflammation and effectively classifying RHD cases.,2021.0,1740, To be annotated, Plasma
PXD015927,The landscape of phospho-tyrosine mediated protein interactions of human receptor tyrosine kinases,2020.0,1648, To be annotated, Interactions
PXD013231,"Analysis of 1,508 plasma samples of the DiOGenes study - Robust, single shot capillary flow data-independent acquisition to decipher proteomic profiles of weight loss and maintenance",2019.0,1590, Analyzed, Plasma
PXD013868,Arabidopsis proteomic tissue atlas,2019.0,1561, To be analyzed, Tissue Arabidopsis proteome
PXD005354,Pharmacoproteomic characterisation of human colon and rectal cancer - CRC65 Full Proteomes,2017.0,1560, To be annotated, Tumor
PXD006512,Proteome Landscape of Early Stage Hepatocellular Carcinoma Identifies Proteomic Subtypes and New Therapeutic Targets,2019.0,1488, Tumor data
PXD002870,Protein Turnover Rates in Normal and Hypertrophy Mouse Hearts,2015.0,1477, To be annoated, Mouse heart
PXD019643,The HLA-Ligand-Atlas. A resource of natural HLA ligands presented on benign tissues,2020.0,1470, Analyzed Tissue, Inmunopeptidomics
PXD004732,ProteomeTools -  Building ProteomeTools based on a complete synthetic human proteome,2017.0,1460, Synthetic data
PXD006895,SubCellBarcode: Scalable proteome-wide mapping of protein localization and relocalization,2017.0,1440
PXD010957,Proteome analysis of huntingtin knock-in allelic series - Muscle,2018.0,1440
PXD001945,CPTAC proteomic analysis of TCGA colon and rectal carcinomas using standard and customized databases,2015.0,1425
PXD005353,Pharmacoproteomic characterisation of human colon and rectal cancer - CPTAC Full Proteomes,2017.0,1425
PXD013668,In vivo identification of GTPase  interactors by mitochondrial relocalizationand proximity biotinylation,2019.0,1380, To be annotated, Interactions
PXD000865,Mass spectrometry based draft of the human proteome,2014.0,1364, Analyzed, Tissue proteome
PXD005641,Proteome analysis of huntingtin knock-in allelic series - Liver,2017.0,1356
PXD033629,MiPRISMA: Interactome profiling of small peptides and young microproteins translated from human short open reading frames Part2,2022.0,1342
PXD010893,Yeast Phospho QTL (resubmission),2020.0,1315, ,
PXD024487,SPIN - Species by Proteome INvestigation,2022.0,1312, ,
PXD010958,Proteome analysis of huntingtin knock-in allelic series - Heart,2018.0,1308, ,
PXD004242,Plasma Proteome Profiling Reveals the Effects of Weight Loss on the Apolipoprotein Family and Systemic Inflammation Status,2016.0,1290, Analyzed, Plasma
PXD037406,An oncogene addiction phosphorylation signature and its derived scores inform tumor responsiveness to targeted therapies,2022.0,1286, ,
PXD031162,Thermal proteome profiling of childhood ALL cell lines for proteoform detection,2022.0,1271, ,
PXD002322,Panorama of ancient metazoan macromolecular complexes: Homo sapiens,2015.0,1203, To be annotated, Interactions
PXD006302,Proteome analysis of huntingtin knock-in allelic series - Striatum,2017.0,1187, ,
PXD010671,"Mouse brain protein turnover - Brain protein turnover in mouse models of neurodegeneration, and in ageing healthy tissue",2018.0,1186, To be annotated, Mouse Tissue proteome
PXD015578,Alzheimer stage proteomics study,2019.0,1186, To be annotated, Alazheimer proteome
PXD001796,Integration of transcriptome and proteome annotation in the naive Ixodes ricinus midgut with genome sequencing,2017.0,1161
PXD011182,EPIC: Software Toolkit for Elution Profile-Based Inference of Protein Complexes,2018.0,1160
PXD015427,Tissue Thermal Proteome Profiling,2019.0,1145
PXD023119,ProteomeTools Part IV - TMT labeled non-modified tryptic peptides,2020.0,1135, To be annotated, Synthetic data
PXD023662,Proteomics analysis of childhood acute lymphoblastic leukemia cell lines reveals novel drug vulnerabilities,2021.0,1114, To be annotated, Drug response
PXD005485,Proteome analysis of huntingtin knock-in allelic series - Cortex,2016.0,1104,,
PXD005538,Proteome analysis of huntingtin knock-in allelic series - Hippocampus,2016.0,1104,,
PXD005526,Proteome analysis of huntingtin knock-in allelic series - Cerebellum,2016.0,1102,,
PXD007048,Cell-specific proteome analyses of human bone marrow upon aging.,2018.0,1079,,
PXD012423,Proteome-wide solubility and thermal stability profiling reveals distinct regulatory roles for ATP - TPP datasets,2019.0,1069,,
PXD006277,Developmental profile of core postsynaptic density protein complexes integrates signaling components of brain disorders,2017.0,1058,To be annotated, Interactions
PXD006607,Proteomic analysis of human Medulloblastoma reveals distinct activated pathways between subgroups,2020.0,1028
PXD004452,"HeLa proteome of 12,250 protein-coding genes",2016.0,1023, Annotated, Cell lines
PXD017149,Integrative -omics and HLA-ligandomics analysis to identify novel drug targets for ccRCC immunotherapy,2020.0,1018, To be annotated, inmunopeptidomics
PXD008840,A proteomic landscape of diffuse-type gastric cancer,2018.0,1016, To be annotated Tumor data, Tumor
PXD008654,Proteomic profiling of paired interstitial fluids revealed dysregulated pathways and salivary NID1 as a biomarker of oral cavity squamous cell carcinoma,2018.0,1000
PXD002534,"A method to characterize antibody selectivity immunoprecipitation, part 2",2015.0,995
PXD029360,Generation of ENSEMBL-based proteogenomics databases boost the identification of novel peptides,2021.0,994
PXD000321,"Signatures for Mass Spectrometry Data Quality, part 2 of 5",2013.0,993
PXD022662,Development of a multiplex targeted mass spectrometry assay to quantify levels of LRRK2 phosphorylated Rab substrates and Ser910 and Ser935 biomarker sites,2020.0,988
PXD000324,"Signatures for Mass Spectrometry Data Quality, part 5 of 5",2013.0,987
PXD006537,Large Cohort Proteomics Profiling of Human Brain Cortex,2019.0,982, To be annotated, Alzheimer proteome
PXD001471,Proteomic analysis of cellular soluble proteins from human bronchial smooth muscle cells by combining nondenaturing micro 2DE and quantitative LC-MS/MS: Preparation of more than 4000 native protein maps,2014.0,967
PXD031107,Proteogenomic analysis of relapsed acute myeloid leukemia in adults and children,2022.0,960, To be annotated, Tumor
PXD020642,H2S regulation the metabolism of cucumber in response to salt-stress through transcriptome and proteome analysis,2020.0,946
PXD000479,Annotation of the zebrafish genome through an integrated transcriptomic and proteomic analysis,2013.0,944
PXD024229,Associations between cellular energy and pediatric inflammatory bowel disease patient response to treatment,2021.0,931
PXD010144,"RhoGAP/GEF Interactome - In this project we cloned 141 mammalian RhoGAPs/GEFs (112 human, 26 mouse, 2 rat, 1 chimpanzee) and performed a systematic study of their interactome, localisation and specificity. Here we submit the mass spectrometry data from the interactome screen.",2018.0,908
PXD020517,Quantitative PTM Maps of Human Pathologic Tau Identify Patient Heterogeneity and Define Critical Steps in Alzheimer’s Disease Progression - angular gyrus,2020.0,901
PXD005479,Proteomic profiling of NCI-60 extracellular vesicles uncovers common protein cargo and cancer type-specific biomarkers,2016.0,900
PXD010595,ProteomeTools – Part II -  Prosit: proteome-wide prediction of peptide tandem mass spectra by deep learning,2018.0,888, To be annotated, Synthetic data
PXD009039,Dissecting the malaria interactome,2018.0,871, ,
PXD002325,Panorama of ancient metazoan macromolecular complexes: Sea urchin,2015.0,864,,
PXD015943,Chemical phosphoproteomics reveals kinase network topologies associated to genotypes and phenotypes of cancer cells.,2020.0,846,,
PXD006003,Proteomics of melanoma response to immunotherapy reveals dependence on mitochondrial function,2019.0,842
PXD009160,BXD Mouse Aging Liver Proteomics,2018.0,839
PXD023120,ProteomeTools Part V - TMT labeled non-modified non-tryptic peptides,2020.0,833,To be annotated,Synthetic data
PXD023690,Spatial-proteomics reveals phospho-signaling dynamics at subcellular resolution,2021.0,832
PXD004269,The response of the root proteome to the synthetic strigolactone GR24 in Arabidopsis,2016.0,831
PXD008888,Chromatin proteomics experiments for ProteomeHD,2019.0,827
PXD002319,Panorama of ancient metazoan macromolecular complexes: Caenorhabditis elegans,2015.0,821
PXD000953,The Pan-Human Library: A repository of assays to quantify 10 000 proteins by SWATH-MS,2014.0,815, To be annotated, Cell lines
PXD012395,Yeast Phosphorylation Database,2019.0,811, To be annotated, Tissue Yeast proteome
PXD011640,Comparison of Proteomic Responses,2018.0,776,,
PXD000323,"Signatures for Mass Spectrometry Data Quality, part 4 of 5",2013.0,771,,
PXD024448,Novel potentially clinically valuable protein markers of androgen activity in humans,2021.0,770
PXD007288,Protein correlation of Mus musculus tissues,2017.0,767, To be annotated, Tissue mouse proteomes
PXD002799,Nuclear proteomics in acute myeloid leukemia,2019.0,767, To be annotated, Tumor
PXD023488,Non-lethal stress-induced discrete proteolysis is caspase-3/7 dependent,2021.0,742
PXD005086,Ascending colon biopsies from pediatric patients,2016.0,741
PXD022872,GENETIC SUBTYPE- AND CELL TYPE-SPECIFIC PROTEIN SIGNATURES IN FRONTOTEMPORAL DEMENTIA,2020.0,736
PXD005946,"Global Proteome Analysis of the NCI-60 Cell Line Panel, part 3",2017.0,732, To be annotated, Cell lines.
PXD001128,Integrating transcriptomics and proteomics data for accurate assembly and annotation of genomes,2015.0,725
PXD012710,Arabidopsis proteome spectral library,2019.0,722, To be annotated, Tissue Arabidopsis proteome
PXD004678,Proteomics of human dendritic cell subsets,2016.0,720, To be annotated, Plasma
PXD006339,LC-MS/MS proteomics on glomeruli from individuals with extreme duration of type 1 diabetes,2017.0,720, To be annotated, Tissue proteome
PXD014980,Molecular analysis of clinically defined subsets of high-grade serous ovarian cancer,2019.0,720, To be annotated, Tumor
PXD025055,Identification of a novel class of cytotoxic granules as origin of supramolecular attack particles in T lymphocytes,2021.0,718,,
PXD018667,Quantitative phosphoproteome of contracting C2 myotubes with pharmacological intervention of the PI3K-AKT-mTOR-S6K and RAF-MEK-ERK-RSK cascades,2020.0,715
PXD008468,Plasma proteomics reveals the confounding effect of heparin administration on the analysis of candidate cardiovascular biomarkers - Cohort2,2017.0,710, To be annotated, Plasma
PXD009348,Plasma proteome profiling reveals global and specific changes of inflammatory and lipid homeostasis markers after bariatric surgery,2018.0,709
PXD019639,The protein interaction landscape of breast cancer,2020.0,702, To be annotated, Interactions
PXD004998,Detection of Five Solid Carcinomas Using Blood Circulating Proteins,2017.0,700, To be annotated, Plasma Cancer
PXD005138,Phosphodiesterase 10A inhibition improves cortico-basal ganglia function in Huntington’s disease models,2016.0,696
PXD010429,Proteogenomic Landscape of Squamous Cell Lung Cancer 2: Tandem Mass Tag Datasets,2018.0,696
PXD011938,"2D gel-based proteomics of primary human peritoneal mesothelial cells derived from omentum",2018.0,696
PXD005955,Systems pharmacology dissection of cholesterol regulation reveals determinants of large pharmacodynamic variability between cell lines,2017.0,694
PXD011957,Exosomes harbor B cell targets in pancreatic adenocarcinoma and exert decoy function against complement-mediated cytotoxicityc,2018.0,693
PXD000600,Temporal dynamics of protein synthesis and secretion during LPS activation of macrophages,2013.0,691
PXD012000,Clinical proteomics of invasive breast carcinoma reveals a major role for proline metabolism in imparting drug resistance,2018.0,689
PXD033651,MiPRISMA: Interactome profiling of small peptides and young microproteins translated from human short open reading frames Part1,2022.0,684
PXD038871,Extracellular vesicle membrane protein profiling and targeted mass spectrometry unveil novel plasma biomarkers for detection of colorectal cancer,2022.0,681
PXD001075,Identification of biomarkers for PKD1 using urinary exosomes,2014.0,678
PXD011322,KRAB Zincfinger Interactome -  The interactome of KRAB zinc finger proteins reveals the evolutionary history of their functional diversification,2018.0,676
PXD007705,Comparative proteomics reveals a diagnostic signature for pulmonary head-and-neck cancer metastasis.,2018.0,676
PXD007214,Systematic proteomic analysis of LRRK2-mediated Rab GTPase phosphorylation establishes a connection to ciliogenesis,2017.0,676
PXD006253,Stichodactyla haddoni - Proteomic analysis of milked venom,2017.0,674
PXD016999,A Quantitative Proteome Map of the Human Body,2020.0,672
PXD003903,HipSci project pilot submission for 18 IPS cell lines,2016.0,672
PXD008003,"Endogenous, in vivo, and site-specific characterization of the SUMO architecture across species and organs",2017.0,668
PXD020108,Global proteome and phosphoproteome alterations in 3rd generation EGFR TKI resistance reveal drug targets to circumvent resistance,2020.0,666
PXD012413,Type 1 Diabetes: Urinary Proteomics and Protein Network Analysis Support Perturbation of Lysosomal Function.,2019.0,664
PXD012134,Growth cone-enriched proteome of embryonic to early postnatal mouse brain,2018.0,660
PXD004113,Proteome and Secretome Analysis Reveals Differential Post-Transcriptional Regulation of Toll-Like Receptor Responses,2017.0,658
PXD006201,Characterisation of protein ubiquitination using UbiSite technology,2017.0,645
PXD008675,Gut Microbial Ecosystem Multiomics in Inflammatory Bowel Disease,2018.0,641
PXD025745,The MICOS-MIB complex member PERM1 connects mitochondria with the sarcolemma via ankyrin B,2021.0,641
PXD022225,Combining mass spectrometry and machine learning to discover bioactive peptides,2020.0,639
PXD034656,Npl3 functions in mRNP assembly by recruitment of mRNP components to the transcription site and their transfer onto the mRNA,2022.0,639
PXD029143,Noninvasive Nasopharyngeal Proteomics Identify Coagulation Abnormalities in SARS-CoV-2,2021.0,638
PXD029655,Proteomic discovery of chemical probes that perturb protein complexes in human cells,2022.0,637
PXD001548,Rapid High-pH Reverse Phase StageTip for Sensitive Small-Scale Membrane Proteomic Profiling,2015.0,633
PXD014800,Salivary proteome signatures in the early and middle stages of human pregnancy with term birth outcome,2019.0,633
PXD012636,The protein expression landscape of the heart across humans and model organisms,2019.0,632
PXD010557,HipSci: the  iPSC proteomic compendium,2019.0,632
PXD000551,"Structural, molecular and cellular impact of the Ogden syndrome mutant N-terminal acetyltransferase hNaa10-Ser37Pro",2016.0,631
PXD006151,Definition of a high-confidence mitochondrial proteome at quantitative scale_pure versus crude mitochondria,2017.0,628
PXD002306,Human Prostate Tumor Subtypes,2015.0,626
PXD020212,Proteomic Discovery and Validation of Diagnostic Plasma Biomarkers for Pulmonary Tuberculosis,2020.0,624
PXD005002,Towards a comprehensive targeted proteogenomic assay repository for the liquid fraction of sheep blood,2016.0,624
PXD000153,Complete Expressed Proteome of Bartonella Henselae,2013.0,622
PXD000419,Comparative Proteomics in Primates,2013.0,621
PXD022435,Proteome and phosphoproteome of human bladder cancer tissue,2020.0,620
PXD012958,Proteomics pipeline for identifying variant proteins in Plasmodium falciparum parasites isolated from children presenting with malaria,2019.0,619
PXD006291,HiRIEFII proteomics and proteogenomics of A431 cells and five histologically normal tissues,2017.0,618
PXD008373,Proteome Landscape of Early Stage Hepatocellular Carcinoma Identifies Proteomic Subtypes and New Therapeutic Targets - Phosphorylation data,2017.0,618
PXD013271,Multilayered control of protein turnover by TORC1 and ATG1,2019.0,614
PXD025752,A time-resolved proteomic and prognostic map of COVID-19,2021.0,614
PXD005252,Time-resolved analysis reveals rapid dynamics and broad scope of the CBP/p300 acetylome,2018.0,612
PXD006675,Region and cell-type resolved quantitative proteomic map of the human heart and its application to atrial fibrillation,2017.0,610
PXD002442,Serum glycoprotein biomarker discovery and qualification pipeline reveals novel diagnostic biomarkers for esophageal adenocarcinoma,2015.0,609
PXD019910,CSF proteomic study of Alzheimer's Disease,2020.0,606
PXD004701,proteotypes of 76 breast cancer cell lines by PCT-SWATH,2016.0,604
PXD003598,Cyclin-dependant kinase (CDK) orders the cell cycle via substrate specific thresholds,2018.0,602
PXD008794,Molecular profiling of vascular beds in vivo by DISDIVO,2018.0,601
PXD003674,"The CLASP2 Protein Interaction Network in Adipocytes Links CLIP2 to AGAP3, CLASP2 to G2L1, MARK2, and SOGA1, and Identifies SOGA1 as a Microtubule-Associated Protein",2017.0,600
PXD001199,Systematic identification of hypothetical bacteriophage proteins targeting key protein complexes of Pseudomonas aeruginosa,2014.0,600
PXD036025,"Proteogenomic analysis of lung adenocarcinoma reveals tumor heterogeneity, survival determinants and therapeutically-relevant pathways",2022.0,600
PXD026468,Large scale toxicoepigenetics on histones: a mass spectrometry-based screening assay applied to developmental toxicity,2021.0,596
PXD029082,Proteogenomic Discovery of Neoantigens Facilitates Personalized Multi-antigen Targeted T cell Immunotherapy for Brain Tumors,2021.0,595
PXD009874,Toward the quantitative characterization of arginine phosphorylations in Staphylococcus aureus,2018.0,595
PXD005405,Comparative evaluation of small molecular additives and their effects on peptide/protein identification,2016.0,592
PXD010688,"ABLE-SWATH -  A Case Study and Methodology for OpenSWATH Parameter Optimization Using the ProCan90 Data Set and 45,810 Computational Analysis Runs",2018.0,590
PXD005478,"Clinical ""in vivo"" samples Beijing B0/W148 LC-MS/MS",2016.0,583
PXD008739,Localised protein expression changes in different regions of human Alzheimer’s brain correlate with disease severity - Hippocampus,2018.0,580
PXD010288,Global proteome rearrangement screen in interphasic and mitotic HeLa CCL2 cell line by SEC-SWATH-MS,2018.0,579
PXD022903,Combined Peptide array screen and proximity labeling proteomics fine map C/EBPa protein interactions,2020.0,578
PXD011304,Macromolecular connectivity landscape of mammalian brain,2018.0,578
PXD013791,Adaptation of Dinoroseobacter shibae to different kinds of oxidative stress,2019.0,576
PXD000129,Drosophila immune response -  Landscape of protein-protein interactions in Drosophila immune deficiency signaling during bacterial challenge,2013.0,576
PXD005968,Prediction of protein complexes in Trypanosoma brucei by protein correlation profiling mass spectrometry and machine learning,2018.0,575
PXD019169,Genome-wide pQTL analysis of protein expression regulatory networks in the human liver,2020.0,574
PXD000084,Honey Bee Proteome Atlas -  Honey bee protein atlas at organ-level resolution,2012.0,572
PXD009822,Life history shapes variation in egg composition in a wild passerine,2018.0,572
PXD040957,Proteomics of immune cells from liver tumors reveals immunotherapy targets,2023.0,571
PXD023118,Human normal and peritumor liver tissues LC-MSMS,2020.0,570
PXD023654,Hybrid label-free quantification proteomics and QconCAT-assisted quantification of amylase-trypsin inhibitors from flours of 150 wheat varieties (3 field locations) by LC-MSE,2021.0,569
PXD015397,Tissue Thermal Proteome Profiling,2019.0,567
PXD021398,Deep learning boosts immunopeptidomics one mass spectrum at a time,2020.0,566
PXD003223,Oncogenic KRAS Regulates Tumor Cell Signaling via Stromal Reciprocation,2016.0,565
PXD007976,Landscape of nuclear transport receptor cargo specificity,2017.0,564
PXD022285,Nanoparticle Protein Coronas Differentially Interrogate Proteomes with Superior Performance Compared to Conventional Deep Proteome Workflows,2020.0,564
PXD018301,Tissue- and plasma-derived exosomal protein biomarkers define multiple human cancers,2020.0,563
PXD010847,Proteome evolution under essential resource limitation,2018.0,561
PXD000320,"Signatures for Mass Spectrometry Data Quality, part 1 of 5",2013.0,560
PXD004312,A mitochondrial proteome profile of type 2 diabetes mellitus in skeletal muscles,2016.0,560
PXD004804,Assassin bug (Pristhesancus plagipennis) venom proteome,2017.0,560
PXD021331,The trade-off hypothesis of oocyte quantity and quality in gonadotropin-stimulated ovarian regime: proteome profile of superovulated vs naturally ovulated mouse oocytes,2020.0,559
PXD023175,A blood atlas of COVID-19 defines hallmarks of disease severity and specificity,2022.0,559
PXD000359,SILAC-based proteomics of human primary endothelial cell morphogenesis unveils tumor angiogenic markers,2013.0,559
PXD031419,Distinct cell type-specific protein signatures in GRN and MAPT genetic subtypes of frontotemporal dementia,2022.0,556
PXD009063,Multi-OMICS data of a Hyper IgD Syndrome family,2018.0,555
PXD025484,Peripheral blood proteomic signature of newly diagnosed prostate cancer,2021.0,552
PXD019469,A head and neck cancer protein interaction map reveals PIK3CA mutant drug sensitivity,2020.0,551
PXD005216,The differential plasma proteome of obese and overweight individuals undergoing a nutritional weight loss and maintenance intervention,2016.0,545
PXD018363,Proteome-scale correlation analysis between urinary extracellular vesicle (uEV) and kidney,2021.0,544
PXD008819,Confirmation of SOMAmer® Enrichment from Biological Matrices using Mass Spectrometry,2018.0,543
PXD031579,Alterations of oral microbiota and impact on the gut microbiome in type 1 diabetes mellitus revealed by multi-omic analysis,2022.0,540
PXD017929,Thermal proteome profiling of yeast phosphodeficient mutants,2021.0,540
PXD012062,Metaproteomics of plastic biofilms in marine environments,2020.0,540
PXD016782,Digestion of a variety of synthetic peptides by proteasomes,2020.0,539
PXD002892,PCP SILAC of apoptosis initiation,2015.0,536
PXD020751,Host-interactor screens of Phytophthora infestans RXLR proteins,2020.0,532
PXD008145,Skeletal muscle-specific methyltransferase METTL21C trimethylates p97 and regulates autophagy-associated protein breakdown,2017.0,532
PXD015104,Expedited mapping of the ligandable proteome using fully functionalized enantiomeric probe pairs,2019.0,531
PXD000493,Proteomics dataset for interphase chromatin probabilities,2014.0,530
PXD024800,Comprehensive micro-scaled proteome and phosphoproteome characterization of archived retrospective cancer repositories,2021.0,529
PXD009173,High persister protein kinase HipA and its gain-of-function variant HipA7 phosphorylate different substrate pools in Escherichia coli,2018.0,529
PXD009602,Mapping the HLA ligandome of Colorectal Cancer Reveals an Imprint of Malignant Cell Transformation,2019.0,528
PXD024995,Revealing the human cancer-associated mucinome,2021.0,528
PXD025432,Metaproteomics of Human Breast Milk and Formula-fed Neonatal Piglets,2021.0,528
PXD003258,A quantitative spatial proteomics analysis of proteome turnover in human cells,2015.0,527
PXD010437,CPTAC High-grade serous ovarian carcinoma SWATH-MS,2020.0,520
PXD003027,AD+CVD temporal lobe proteome -  Gender differences in white matter pathology and mitochondrial dysfunction in Alzheimer's disease with cerebrovascular disease,2015.0,520
PXD027586,Temporal Analysis of Protein Ubiquitylation and Phosphorylation During Parkin-dependent Mitophagy,2021.0,518
PXD021114,HspB8 controls hardening and molecular aging of FUS condensates by domain-specific protein interactions Part 1,2020.0,517
PXD002078,Combined proteomic and transcriptomic analysis of Arion vulgaris,2015.0,517
PXD006637,In vivo Brain GPCR Signaling Elucidated by Phosphoproteomics,2018.0,516
