"accession","title","year","file_count","Status", "Notes"
PXD012544,Investigation of Oligodendrocyte Precursor Cell Differentiation by Quantitative Proteomics,2019.0,121
PXD006939,High-throughput MS-based immunopeptidomics,2017.0,121
PXD035203,Detection and isolation of circulating tumor cells from breast cancer patients using CUB domain-containing protein 1 (CDCP1) Detection and isolation of circulating tumor cells from breast cancer patients using CUB domain-containing protein 1 (CDCP1) Detection and isolation of circulating tumor cells from breast cancer patients using CUB domain-containing protein 1 (CDCP1),2022.0,121
PXD013186,The lactococcal phage p2 protein ORF47 impedes Lactococcus lactis MG1363 resistance to phage infection,2019.0,120
PXD010944,REX1 is the critical target of RNF12 in imprinted X chromosome inactivation in mice.,2018.0,120
PXD000046,Mouse Cerebellum DNA-Damage 2D LC-MS/MS,2012.0,120
PXD022322,Proteomic changes associated with sperm fertilizing ability in meat type roosters,2020.0,120
PXD000511,Cdh1 Proteomic Analysis -  A Synthetic Lethal Interaction between APC/C and Topoisomerase Poisons Uncovered by Proteomic Screens,2013.0,120
PXD026378,Variation in upstream open reading frames contributes to allelic diversity in protein abundance,2021.0,120
PXD009784,Changes in the urinary extracellular vesicle proteome are associated with nephronophthisis-related ciliopathies,2018.0,120
PXD015834,The phase separation-dependent FUS interactome reveals nuclear and cytoplasmic function of liquid-liquid phase separation,2019.0,120
PXD003526,Proteotyping of microbial communities reveals the correlations between the microorganisms and the process parameters,2016.0,120
PXD000647,Functional analysis of novel Rab GTPases identified in the proteome of 2 purified Legionella-containing vacuoles from macrophages,2013.0,120
PXD033224,Phosphoproteomic analysis of Arabidopsis root in response to cellooligomers (cellotriose),2022.0,120
PXD019795,Ordered dephosphorylation initiated by the selective proteolysis of cyclin B drives mitotic exit,2020.0,120
PXD000886,Bacillus cereus proteomics -  Proteomic Evidences for Rex Regulation of Metabolism in Toxin-Producing Bacillus cereus ATCC 14579,2014.0,120
PXD020614,"Passage of transmissible cancers in the Tasmanian devil is due to a dominant, shared peptide motif and a limited repertoire of MHC-I allotypes",2020.0,120
PXD004555,An optimized version of the Secretome protein enrichment with click sugars (SPECS) method leads to enhanced coverage of the secretome,2016.0,120
PXD033649,Combined measurements of proteome and cell turnover reveal the influences of tissue context and pathological aging on protein and organelle lifetimes,2022.0,120
PXD022836,Comparative proteomics for identification of type I interferon response in primary human glioblastoma multiforme cells,2020.0,120
PXD009870,Proteomics of JHS samples identifies proteins associated with heart failure,2018.0,120
PXD017321,Proteomics Using Proteases Alternative to Trypsin Benefits from Sequential Digestion with Trypsin,2020.0,120
PXD016511,Proteomic adaptation of Streptococcus pneumoniae to the human antimicrobial peptide LL-37,2020.0,120
PXD022863,Maize seed proteome of autophagy deficient plants throughout development,2020.0,120
PXD011472,Comparative analysis of CVF proteome composition during neoplastic transformation of cervix among females of reproductive age,2018.0,120
PXD027290,Microscopic and biochemical monitoring of endosomal trafficking and extracellular vesicle secretion in an endogenous in vivo model,2021.0,120
PXD036118,IKKβ binds NLRP3 providing a shortcut to inflammasome activation for rapid immune responses,2022.0,120
PXD017088,The integrin linked kinase is required for chemokine-triggered high affinity conformation of the leukocyte β2-integrin LFA-1The integrin linked kinase is required for chemokine-triggered high affinity conformation of the leukocyte β2-integrin LFA-1,2020.0,120
PXD003977,Expanding proteome coverage with CHarge Ordered Parallel Ion aNalysis (CHOPIN) combined with broad specificity proteolysis,2016.0,120
PXD016551,Positive effect of Manganese on growth of two strains of Granulicella sp. revealed by proteomic and genomic analyses,2019.0,120
PXD014664,Proteomic analysis of septic renal acute phase response,2019.0,120
PXD012522,Biopearling: Chains of interconnected outer membrane vesicles in a marine flavobacterium,2019.0,120
PXD021023,"Investigating byssogenesis with proteomic analysis of byssus, foot and mantle in Mytilus mussels by LC-MS/MS",2020.0,120
PXD000270,Proteome of Burkholderia cenocepacia H111 in aerobic and micro-oxia condition,2013.0,120
PXD017050,A quantitative tissue-specific landscape of protein redox regulation during aging,2020.0,120
PXD025478,Complexome profiling of brain mitochondrial membranes from Clpp-/- mouse,2021.0,120
PXD016496,Arabidopsis thaliana N-terminal Acetylome,2019.0,120
PXD011161,Iron regulation in Clostridioides difficile,2018.0,120
PXD014946,Ablation of SOCS3 in Cardiomyocytes Exacerbates Cardiac hypertrophy and Dysfunction by Increasing GRP78-medieated ER Stress after pressure overload,2019.0,120
PXD020827,"16-plex isobaric mass tags enable streamlined proteomics-based drug mechanism-of-action studies",2020.0,120
PXD012616,Combined proteomics and miRNomics of a glioblastoma immunotherapy cohort reveals resistance factor candidates and novel counterstrategy concepts,2019.0,120
PXD028050,Identification of SUMO targets required to maintain human stem cells in the pluripotent state. - Identification of SUMO modified proteins from hiPS cells,2021.0,120
PXD001258,Correction To - Confetti: A Multi-protease Map of the HeLa Proteome for Comprehensive Proteomics,2014.0,120
PXD016538,Identification of potential ischemic stroke biomarkers through a brain-based multiomics integrative approach in mice,2019.0,120
PXD016549,Extensive Rewiring of the EGFR Network in Colorectal Cancer Cells Expressing Transforming Levels of KRASG13D,2019.0,120
PXD000078,'Life and death' of extracytoplasmic proteins,2012.0,120
PXD016850,Temporal proteomic analyses of the protein contents found in the insoluble fraction of the a-synuclein PFF-treated neurons,2019.0,120
PXD031928,Multi-omics analysis of MEN1 missense mutations identifies disruption of menin-MLL and menin-JunD interactions as critical requirements for molecular pathogenicity,2022.0,120
PXD008297,Proteomics in biomanufacturing control: Protein dynamics of CHO-K1 cells and conditioned media during apoptosis and necrosis,2017.0,120
PXD028950,Impact of fetal growth restriction on neonatal microglia proteome in rat.,2021.0,120
PXD002010,Natural genetic variation on proteome level in Caenorhabditis elegans,2016.0,120
PXD033711,"TAG-TMTpro, a hyperplexing quantitative approach for high-throughput proteomic studies",2022.0,120
PXD011248,DT40 whole cell proteome (SILAC),2018.0,120
PXD011735,Isobaric Labeling Quantitative Metaproteomics for the Study of Gut Microbiome Response to Arsenic,2018.0,120
PXD005347,Alzheimer Disease model detergent insoluble proteomes,2016.0,120
PXD020756,Proteomic analysis of dexamethasone effects on cartilage breakdown,2020.0,120
PXD003419,Expression changes of proteins associated with the development of preeclampsia in maternal plasma: a case control study,2016.0,120
PXD008472,"iTRAQ - based proteomic analyses of sea cucumber Apostichopus japonicus in response to the stresses of heat, hypoxia and heat plus hypoxia",2017.0,120
PXD002194,"The proteome of normal human iris, ciliary body,  retinal pigment epithelium, and choroid",2015.0,120
PXD003180,IP-MS of DCAF1/VprBP interacting proteins in mouse CD4 T cells,2015.0,120
PXD023256,Blocking ERK activity has a selective but critical impact on activating T cells,2020.0,120
PXD026639,Dynamic maps of protein-protein-metabolite complexes in S. cerevisiae,2021.0,120
PXD002209,iTRAQ-Facilitated Proteomic Profiling of Cotton Anthers,2015.0,120
PXD024197,Pre and post ATRA/VP treatment proteomic and phophoproteomic profiling of AML responders and non-responders,2021.0,120
PXD026104,Heterogeneous Expression of Nuclear Encoded Mitochondrial Genes Distinguishes Inhibitory and Excitatory Neurons.,2021.0,120
PXD036033,System-wide vitreous proteome dissection reveals impaired sheddase activity in diabetic retinopathy,2022.0,120
PXD003040,The SILAC fly allows for accurate protein quantification in vivo,2015.0,120
PXD010153,Quantification and discovery of sequence determinants of protein per mRNA amount in 29 human tissues,2018.0,120
PXD025978,"Absolute Proteome Analysis of Hippocampus, Cortex and Cerebellum in Aged and Young Mice Reveals Changes in Energy Metabolism",2021.0,120
PXD002297,Large scale site-specific mapping of the Arabidopsis ubiquitinome,2015.0,120
PXD001220,Characterization of native protein complexes and protein isoform variation using size-fractionation-based quantitative proteomics.,2014.0,120
PXD024540,IGDQ motogenic peptide gradient induces directional cell migration through integrin (αv)β3 activation in metastatic breast cancer,2021.0,120
PXD025261,"27-plex Tandem Mass Tag Mass Spectrometry for Profiling Brain Proteome in Alzheimer's Disease",2021.0,120
PXD008614,zebrafish embryos proteome for slbp2 KO F3 and wild type,2018.0,120
PXD013704,"Systematic Discovery of Deeply Conserved Plant Protein Complexes, DSSO-crosslinked soy (Glycine max)",2019.0,120
PXD013736,Acetyl-CoA flux regulates the proteome and acetyl-proteome to maintain intracellular metabolic crosstalk,2019.0,120
PXD013431,In-depth proteomic analysis for discovery of response prediction markers in breast cancer chemotherpy using needle biopsy FFPE tissue,2019.0,120
PXD016127,Quantitative Proteomic Profiling for Predicting Grade of Dysplasia in Intraductal Papillary Mucinous Neoplasm using Pancreatic Cyst Fluid,2019.0,120
PXD000565,Protein abundance changes and ubiquitylation targets identified upon inhibition of the proteasome with Syringolin A,2014.0,120
PXD004461,PP21Cdc55 phosphatase imposes phosphothreonine-specific ordering of cell cycle phosphorylation,2016.0,120
PXD004241,Quantitative proteomic analysis of HIV-1 Tat-induced dysregulation in SH-SY5Y neuroblastoma cells,2016.0,120
PXD003019,Identification of AMPK phosphorylation sites reveals a network of proteins involved  in cell invasion and facilitates large-scale substrate prediction,2015.0,120
PXD005434,mouse liver kidney LC-MS/MS -  Quantitative Proteomics and Targeted Fatty Acids Analysis Reveal the Damage of Triptolide in Liver and Kidney,2016.0,120
PXD023125,"Translatome proteomics of human AML cells treated with FLT3 inhibitors quizartinib, crenolanib, gilteritinib",2020.0,120
PXD024549,Serum quantitative proteomics identifies prognostic biomarkers and physiological processes related to COVID-19 symptomatology,2021.0,120
PXD012113,Quantitative phosphoproteome and proteome analysis emphasize the influence of phosphorylation events during the nutritional stress of Trypanosoma cruzi: the initial moments of in vitro metacyclogenesis,2018.0,120
PXD023733,Protein citrullination and homocitrullination profiling in mice using LC-MS/MS,2021.0,120
PXD037684,Mass spectrometry-based proteomics analysis of human substantia nigra from Parkinson's disease patients identifies multiple pathways potentially involved in the disease,2022.0,120
PXD002052,Machine Learning Based Classification of Diffuse Large B-cell Lymphoma Patients by their Protein Expression  Profiles,2015.0,120
PXD031648,Mass spectrometry-based proteomics analysis of human globus pallidus from progressive supranuclear palsy patients discovers multiple disease pathways,2022.0,120
PXD000587,Large-scale proteome characterization of the cassava root,2014.0,120
PXD001026,Systematic evaluation of quantotypic peptides for targeted analysis of the human kinome,2014.0,120
PXD016913,Bioplatforms Australia: Antibiotic Resistant Sepsis Pathogens Framework Initiative -   Streptococcus pyogenes,2020.0,120
PXD016840,Bioplatforms Australia: Antibiotic Resistant Sepsis Pathogens Framework Initiative -   Escherichia coli,2019.0,120
PXD007891,iTRAQ LLC-PK1 CnI -  Sum of peak intensities outperforms peak area integration in iTRAQ protein expression measurement by LC-MS/MS using a TripleTOF 5600+ platform,2017.0,120
PXD022750,A small RNA and its involvement in zinc transport,2020.0,120
PXD017380,Arabidopsis Plastoglobule Proteome with ABC1 atypical kinase mutants,2020.0,120
PXD006742,Pseudomonas aeruginosa LC-MS/MS,2017.0,120
PXD040364,Proteomic characterization of Opisthorchis felineus execretory/secretory and tegumental proteins,2023.0,120
PXD021385,Complexome profiling of mitochondrial protein complexes to study the molecular consequences of DNAJC30 mutations,2020.0,120
PXD009577,Getting to the heart of the matter: Multispecies heart tissue proteome characterization,2018.0,120
PXD010380,Platelet proteome is affected by cancer presence and therapy,2018.0,120
PXD008284,Stable isotope labeling by amino acids in cell culture based proteomics reveals differences in protein abundances between spiral and coccoid forms of the gastric pathogen Helicobacter pylori,2017.0,120
PXD000487,A proteome analysis of Bradyrhizobium japonicum USDA 110 grown in minimal medium containing arabinose suggests that oxalate oxidation extends the arabinose degradation branch via glycolaldehyde.,2013.0,120
PXD001799,"Distinct Serum Proteome Profiles Associated with Collagen induced Arthritis, and Complete Freund’s Adjuvant-induced Inflammation in CD38-/- mice: the Discriminative Power of Protein Species or Proteoforms. Protein identification by Peptide Mass Fingerprinting (PMF)",2015.0,120
PXD033597,Proteome compendium of the Antarctic krill (Euphausia superba) - Head,2022.0,120
PXD004937,Global up-regulation of protein degradation in quiescent cells,2016.0,120
PXD030539,thermal proteome profiling of hypomethylating agents in infant ALL,2021.0,120
PXD008146,secretome of human chondrocytes and adipose mesenchymal stem cells,2017.0,120
PXD015887,Subcellular quantitative proteomic analysis of herpes simplex virus type 1 infected HEK 293T cells,2019.0,120
PXD009080,Utilization of alpha- and beta-mannan by marine Flavobacteriia,2018.0,120
PXD016504,Bioplatforms Australia: Antibiotic Resistant Sepsis Pathogens Framework Initiative -   Staphylococcus aureus,2019.0,120
PXD022881,"Combined Protein Signature of ALDH1A1, LGALS3, LGALS3BP Predicts Cancer Recurrence Post-Liver Transplantation Beyond Milan Hepatocellular Carcinoma",2020.0,120
PXD029965,Investigating the proteome of red blood cells and reticulocytes in Polycythemia Vera and Essential Thrombocythemia,2021.0,120
PXD019330,Reshaping of the Arabidopsis thaliana proteome landscape and co-regulation of proteins in development and immunity,2020.0,120
PXD004680,A quantitative map of beta-lactone induced virulence regulation,2017.0,120
PXD011977,Peanut shell iTRAQ data,2018.0,120
PXD022549,Multiparametric characterization of red blood cells physiology after hypotonic dialysis based drug encapsulation process.,2020.0,120
PXD035741,Detailing the Structural and Dynamic Interactions Between WDR44 and Rab11,2022.0,120
PXD022855,Complexome profiling to study assembly of complex III in heart tissue from UQCRH deficient mice,2020.0,120
PXD022352,Macrophage proteome in response to Mycobacterium tuberculosis infection,2020.0,120
PXD008183,Human Ovarian Proteome -  A draft map of the human ovarian proteome for tissue engineering and clinical applications,2017.0,120
PXD032042,Profiling Yeast Deletion Strains using Sample Multiplexing and Network-based Analyses,2022.0,120
PXD027563,Quantification of isoaspartate levels in human serum albumin of blood samples,2021.0,120
PXD003637,TAILS proteomics of murine pancreatic tumors,2016.0,120
PXD011867,Proteaphagy contributes to bortezomib resistance in mantle cell lymphoma,2018.0,120
PXD017681,Molecular markers in the CSF proteome differentiate neuroinflammatory diseases,2020.0,120
PXD011980,Peanut seed iTRAQ project,2018.0,120
PXD003337,Longitudinal quantification of the GCF proteome during progression from gingivitis to periodontitis in a canine model,2015.0,120
PXD037755,Key changes in bovine milk immunoglobulin G during lactation: NeuAc sialylation is a hallmark of colostrum immunoglobulin G N-glycosylation Key changes in bovine milk immunoglobulin G during lactation: NeuAc sialylation is a hallmark of colostrum immunoglobulin G N-glycosylation,2022.0,120
PXD001976,"p53-regulated networks of protein, mRNA, miRNA and lncRNA expression revealed by integrated pSILAC and NGS analyses",2015.0,120
PXD007648,Protein Corona of 60nm Silver Nanoparticles,2018.0,120
PXD033601,Proteome compendium of the Antarctic krill (Euphausia superba) - Muscle,2022.0,120
PXD025217,Topology of the redox network during induction of photosynthesis as revealed by time-resolved proteomics in tobacco,2021.0,120
PXD001977,Alterations in the sputum proteome and transcriptome in smokers and early-stage COPD patients,2015.0,120
PXD003463,"Combining deep-sequencing, proteomics, phosphoproteomics and functional screens to discover novel regulators of sphingolipids homeostasis.",2016.0,120
PXD010796,Optimized cross-linking mass spectrometry for in situ interaction proteomics,2019.0,120
PXD003667,Shedding light on biofilm formation of Halobacterium salinarum R1 by SWATH-LC/MS/MS analysis of planktonic and sessile cells,2016.0,120
PXD025150,LC-MS/MS analysis of pancreatic cancer plasma,2021.0,120
PXD000521,Protein abundance changes and ubiquitylation targets identified upon inhibition of the proteasome with Syringolin A,2014.0,120
PXD033594,Proteome compendium of the Antarctic krill (Euphausia superba) - Carapace,2022.0,120
PXD013622,Comparative analysis of mRNA degradation and protein degradation in prostate tissues indicates high stability of proteins,2019.0,120
PXD003938,Mouse Smooth muscle cell secretome with Anti-miR / pre-miR treatment,2016.0,120
PXD001464,Multiphasic chip performance characterization using human thyroid cancer cell line SW1736 and human plasma,2014.0,120
PXD035289,Temporal proteomics of human cerebrospinal fluid reveals novel differentially-regulated proteins after severe traumatic brain injury,2022.0,120
PXD000149,The potato tuber mitochondrial proteome,2013.0,120
PXD000554,Convergence of Ubiquitylation and Phosphorylation Signaling in Rapamycin-Treated Yeast Cells,2014.0,119
PXD004797,Comparative proteomics of purified pathogen vacuoles correlates intracellular replication of Legionella pneumophila with the small GTPase Rap1,2016.0,119
PXD002871,Phosphoproteomics quantitative characterization in Jurkat E6.1 and Jurkat Gamma1.,2015.0,119
PXD004981,Lapatinib action and resistance in breast cancer,2016.0,119
PXD012018,Mycobacterium tuberculosis glycoproteomic,2018.0,119
PXD003718,Co-immunoprecipitation of HA-tagged proteins in Giardia lamblia,2016.0,119
PXD004958,Proteome and peptidome of Vipera berus berus venom,2016.0,119
PXD000455,Drosophila melanogaster proteome dataset with high coverage of the genome based on the LC-MS/MS platform,2013.0,119
PXD017363,Proteomic analysis of mucopolysaccharidosis IIIB mouse brain,2020.0,119
PXD000071,Rapid and deep profiling of human induced pluripotent stem cell proteome by one-shot nanoLC-MS/MS analysis with meter-scale monolithic silica columns,2012.0,119
PXD000582,Discovery of plasma/serum protein biomarkers for progression from Mycobacterium tuberculosis infection to disease,2019.0,119
PXD015458,Tissue Thermal Proteome Profiling,2019.0,119
PXD027463,Proteomic landscapes of inherited platelet disorders with different etiologies,2022.0,119
PXD007703,Cell type-specific metabolic labelling of nascent proteomes in vivo,2017.0,119
PXD004499,Human temporal neocortex brain LC-MS,2016.0,119
PXD002377,The response of Chlamydomonas reinhardtii to nitrogen deprivation: a systems biology analysis,2015.0,119
PXD022562,Interaction of Chinese cabbage (Brassica rapa ssp. pekinensis) cell wall proteins with mustard leaf beetle (Phaedon cochleariae) polygalacturonase family members,2020.0,119
PXD000293,Ti4+-IMAC label-free quantification,2014.0,119
PXD011049,Hormonal stimulation of carp is accompanied with changes of seminal plasma and spermatozoa proteome,2018.0,119
PXD016960,NanoTPOT: Enhanced Sample Preparation for Quantitative Nanoproteomic Analysis,2020.0,119
PXD037792,Proteomic analysis of vastus lateralis muscle biopsies,2022.0,119
PXD024566,Comparative host interactomes of the SARS-CoV-2 nonstructural protein 3 and human coronavirus homologs,2021.0,119
PXD028390,Proteomic phenotyping of stimulated Müller cells uncovers profound pro-inflammatory signaling and antigen-presenting capacity,2021.0,119
PXD014313,System-wide biochemical analysis reveals ozonide and artemisinin antimalarials initially act by disrupting malaria parasite haemoglobin digestion,2019.0,119
PXD023653,Elp2 mutations perturb the epitranscriptome and lead to a complex neurodevelopmental phenotype,2021.0,118
PXD006058,Grain proteome response to nitrogen and sulfur supply in einkorn (Triticum monococcum),2017.0,118
PXD009335,The FAM83 family of proteins are anchors for Casein Kinase 1 isoforms through the DUF1669 domain,2018.0,118
PXD001068,"Phosphoproteome dynamics in onset and maintenance of Oncogene-Induced Senescence, proteome dataset",2014.0,118
PXD001134,Sample preparation for phosphoproteomic analysis of circadian time series in Arabidopsis thaliana,2014.0,118
PXD021046,Proteomics analysis of insulin sensitive tissues in high fat diet fed mice,2020.0,118
PXD008071,Systems Signature Reveals Unique Remission-path of Diabetes Generated by Gastric Bypass Surgery,2017.0,118
PXD021019,Proteomics analysis of white adipose tissue in high fat diet fed mice,2020.0,118
PXD005831,Concerted regulation of ISWI by an autoinhibitory domain and the H4 N-terminal tail,2017.0,118
PXD037809,Adipocyte-derived extracellular vesicles increase insulin secretion through transport of insulinotropic protein cargo,2022.0,118
PXD010623,Protemic analysis of the effect of c-di-GMP and c-di-AMP on the protein expression of Mycobacterium smegmatis,2018.0,118
PXD008141,Blood plasma and serum samples of healthy donors fractionated on different chromatography sorbents,2017.0,118
PXD003170,Host-microbiota interactions in the pathogenesis of antibiotic-associated diseases:Fecal Transplant,2015.0,118
PXD004929,"NIH 3T3 AHA p-c, SILAC p-c, inhibitor, and enrichment control experiments",2016.0,118
PXD005559,"Proteome profiling of human neutrophil granule subsets, secretory vesicles, and cell membrane",2016.0,118
PXD007220,DSS Microbiota LC-MS/MS,2017.0,118
PXD001981,Secretome of P2X7 receptor -  Macrophage activation and polarization modify P2X7 receptor secretome influencing the inflammatory process,2015.0,118
PXD005692,Analysis of Human Breast Tumors by Integrated Proteotranscriptomics,2017.0,118
PXD033775,Proteome compendium of the Antarctic krill (Euphausia superba) - Telson,2022.0,118
PXD001396,mTRAQ labeled natural proteome from HeLa,2014.0,117
PXD020959,"LepR deficiency, MEFs and iPSCs, LC-MS/MS",2020.0,117
PXD019859,Translational activity of the splicing factor SRSF1 is required for development and cilia function,2021.0,117
PXD008630,T-cell protein half live -  Multiplexed Proteome Dynamics Profiling Reveals Mechanisms Controlling Protein Homeostasis,2018.0,117
PXD009902,Proteomic Analysis of an Arsenic Response Locus,2018.0,117
PXD008445,Patients with early stage oropharyngeal squamous cell carcinoma can be identified with label-free serum proteomics,2017.0,117
PXD018976,"Mapping specificity, entropy, allosteric changes and substrates in blood coagulation proteases by a high-throughput protease screen",2020.0,117
PXD003914,Identification of Proteins Sensitive to Thermal Stress in Human Neuroblastoma and Glioma Cell Lines,2016.0,117
PXD016588,Expression of proteins by a marine Brevibacterium casei #NIOSBA88 in response to Arsenic and Chromium,2019.0,117
PXD002401,Multi-omics toxicity profiling of engineered nanomaterials,2015.0,117
PXD012632,STRUCTURAL WEAKENING OF THE COLONIC MUCUS BARRIER IS AN EARLY EVENT IN ULCERATIVE COLITIS PATHOGENESIS,2019.0,117
PXD025462,Multisystem inflammatory syndrome in children (MIS-C) serum proteomics,2021.0,117
PXD010637,Integrated transcriptomic and proteomic analysis of human eccrine sweat glands,2018.0,117
PXD037667,Curcuminoid Supplementation in Canine Diabetic Mellitus and its Complications using Proteomic Analysis,2022.0,117
PXD001731,Large-Scale Targeted Proteomics Using Internal Standard Triggered-Parallel Reaction Monitoring,2015.0,117
PXD024990,Metaproteomic profiling of the intestinal microbiota of SARS-CoV-2 infected patients,2021.0,117
PXD002597,The Skin Barrier Defects Caused by Keratinocyte-Specific Deletion of ADAM17 or EGFR are Based on Highly Similar Proteome and Degradome Alterations,2015.0,117
PXD025933,Proteomics characterisation of induced pluripotent stem cells and cortical brain organoids.,2021.0,117
PXD004236,In vivo protein interaction network analysis reveals porin-localized toxin inactivation in antibiotic resistant bacteria,2016.0,117
PXD034221,Serum proteomics profiling identifies a signature  for lung cancer early diagnosis,2022.0,116
PXD016038,"Multi-condition affinity capture/MS analysis of LAP-tagged human NCBP1, NCBP2, and NCBP3",2019.0,116
PXD011071,Defining the RNA Interactome by Total RNA-Associated Protein Purification,2019.0,116
PXD022835,Diagnosis of hepatocellular adenomas and malignancy determination by proteomic patterns matching (1),2020.0,116
PXD010644,Plasmodium falciparum bromo-domain containing epigenetic protein complexes recruited to modified histone tails as identified by histone peptide pulldown (HPP)-MS/MS and further characterized by GFP-IP-MS/MS and HA-IP-MS/MS,2018.0,116
PXD002532,Proteomic QSAR analysis of calpain substrate specificity,2015.0,116
