"accession","title","year","file_count","Status", "Notes"
PXD016958,Proteomic analysis of microdissected renal tubules,2020.0,180
PXD028928,Long-term nutritional regulation of liver proteome,2021.0,180
PXD028902,Temporal and site-specific ADP-ribosylation dynamics upon different genotoxic stresses,2021.0,180
PXD008832,Evaluation of preservation quality and viability of FFPE ovarian cancer tissue samples,2018.0,180
PXD022856,Complexome profiling of mitochondrial protein complexes to study assembly of complex III and supercomplex stability in patients with defects in UQCRH gene,2020.0,180
PXD004709,Proteomic profiles of Rat Pancreatic Islets,2016.0,180
PXD003497,Quantification of Proteome heterogeneity in benign and malignant prostate tissues,2016.0,180
PXD001450,Characterization and quantification of chicken eggshell proteins during pivotal events of shell calcification,2014.0,180
PXD004887,Large-scale Perspective on Protein Dynamics in Tomato Fruit Tissues Development through Label-free Deep Shotgun Proteomics,2016.0,180
PXD004744,TDP-43 loss of function inhibits endosomal trafficking and alters trophic signaling in neurons - Surface labelling,2016.0,180
PXD023970,Proteomic Analysis of the Lake Trout (Salvelinus namaycush) Heart and Blood: the beginning of a comprehensive lake trout protein database,2021.0,180
PXD006921,Splicing factor Ybx1 maintains persistent Jak2-mutated neoplasms via Mknk1-ERK-signaling,2020.0,180
PXD036803,Integrated omic analysis reveals multilevel control of renal and systemic metabolism by the renal tubular circadian clock,2022.0,180
PXD028371,Signalling and recycling endosomes_dataset 03,2021.0,180
PXD025439,Membrane enriched temperature series proteome of Francisella tularensis subspecies novicida in wild type and lipid A acyltransferase null mutants.,2021.0,180
PXD005945,Deep LC-MS/MS analysis of the proteome from six cell lines,2017.0,180
PXD017840,Complexome profiling of human cybrids laking mitochondrial genes Cox1 or Cox2,2020.0,180
PXD022614,Influence of spermidine on the mouse brain proteome,2020.0,180
PXD030532,Cross-linking of the Endolysosomal System Reveals Potential Flotillin Structures and Cargo,2021.0,180
PXD003844,Cellulose and hemicellulose decomposition by forest soil bacteria proceeds by the action of structurally variable enzymatic systems,2016.0,180
PXD000941,"Differences in proteasome targeting in Arabidopsis leaf mesophyll, epidermal and vascular cells",2014.0,180
PXD000316,A Saccharomyces Cerevisiae model reveals in vivo functional impairment of the ogden syndrome n-terminal acetyltransferase Naa10-S37p mutant,2013.0,180
PXD010627,Drosophila Testis Proteome -  Stage-specific testes proteomics of Drosophila melanogaster identifies essential proteins for male fertility,2018.0,180
PXD023017,Complexome profiling of mitochondrial complexes isolated from seedlings or mature leaves,2020.0,180
PXD012238,Deep proteome profiling of hippocampus in 5xFAD mouse model,2019.0,180
PXD017271,"Assessing the Effects of Redox Modifier MnTnBuOE-2-PyP 5+ on Cognition and Hippocampal Physiology Following Doxorubicin, Cyclophosphamide, and Paclitaxel Treatment",2020.0,180
PXD017224,Quantitative proteomic analysis of SFTSV infected THP-1 cells,2020.0,180
PXD011482,Deep undepleted human serum proteome profiling toward biomarker discovery for Alzheimer’s disease,2018.0,180
PXD032980,Phosphoproteomics defines two biologically distinct groups of KMT2A rearranged acute myeloid leukaemia with different drug response phenotypes,2022.0,180
PXD001275,The meiotic proteome in yeast -  The protein expression landscape of mitosis and meiosis in diploid budding yeast,2014.0,180
PXD015679,membrane substrates of gingipains,2019.0,180
PXD017606,Bioplatforms Australia: Antibiotic Resistant Sepsis Pathogens Framework Initiative -   Streptococcus pneumoniae,2020.0,180
PXD036962,Comparative proteomic and transcriptomic analysis of the impact of androgen stimulation and darolutamide inhibition on prostate cancer cells,2022.0,180
PXD006850,Arabidopsis Myristoylom -  Targeted Profiling of Arabidopsis thaliana Subproteomes Illuminates Co- and Posttranslationally N-Terminal Myristoylated Proteins,2017.0,179
PXD002452,Characterisation of two distinct Nucleosome Remodelling and Deacetylase Complex (NuRD) assemblies in embryonic stem cells.,2015.0,179
PXD011924,Proteomic analysis of the lake trout (Salvelinus namaycush),2018.0,179
PXD000498,The quantitative and condition-dependent Escherichia coli proteome,2015.0,179
PXD009025,Quantification of calcyclin and heat shock protein 90 in sera from women with and without preeclampsia by mass spectrometry,2018.0,179
PXD008838,The farmed Atlantic salmon (Salmo salar) skin-mucus proteome,2018.0,179
PXD024219,Network analysis of the CSF proteome characterises convergent pathways of cellular dysfunction in ALS,2021.0,179
PXD017039,Broad and thematic remodeling of the surface glycoproteome on isogenic cells tranformed with driving proliferative oncogenes,2020.0,178
PXD005760,A Proteomic View of Escherichia coli Metabolic Features,2017.0,178
PXD000243,"Telomeric protein composition deriving from q-TIP analysis comparing Hela supertelomerase cells, Hela TRF2 knockdown cells or Hela POT1 knockdown cells with Hela control cells,  proteomes by 2D-LC-MS/MS",2013.0,178
PXD017343,Analysis of CD5 signalosome in primary T cells,2020.0,178
PXD030936,Red blood cells protein profile is modified in breast cancer patients,2022.0,178
PXD035303,Global Extracellular Vesicle Proteome Changes Across Time Upon Intraarticular Treatment of Mesenchymal Stromal Cells in an In Vivo model of Equine Osteoarthritis,2022.0,178
PXD035324,The antigenic landscape of multiple myeloma: mass spectrometry (re)defines targets for T-cell–based immunotherapy,2022.0,177
PXD016494,plasma membrane anchored NAA60 N-terminal acetylation profiling in Arabidopsis thaliana,2019.0,177
PXD027163,The inflammation repressor TNIP1 is degraded by selective autophagy in a LIR-dependent manner upon TLR3 activation,2021.0,177
PXD001198,In Vivo Assessment of Protease Dynamics in Cutaneous Wound Healing by Degradomics Analysis of Porcine Wound Exudates,2014.0,177
PXD000867,Cell type-resolved quantitative proteomics of mouse liver,2014.0,177
PXD000783,The Phophoproteome of Chlamydomonas reinhardtii,2014.0,177
PXD031071,Parallelized multidimensional analytic framework applied to mammalian cells uncovers novel regulatory principles in EMT,2022.0,177
PXD013343,Simple targeted assays for metabolic pathways and signaling: a powerful tool for targeted proteomics,2021.0,177
PXD026313,Adaptations in metabolism and protein translation give rise to the Crabtree effect in yeast,2021.0,177
PXD015845,Phosphoproteomic Characterization of Signaling Networks Resulting from Activation of Chemokine Receptor CCR2,2019.0,177
PXD003927,Absolute Quantification of 10 Centrosomal Proteins,2016.0,177
PXD003271,Proteomic analysis of clear cell renal cell carcinoma tissue versus matched normal kidney tissue,2015.0,177
PXD012024,Dual targeting of BCR-ABL1 and IRE1α is a promising therapeutic strategy in Ph+ ALL,2018.0,176
PXD009009,Integrated Omics Profiling Identifies Hypoxia-Regulated Genes in HCT116 Colon Cancer Cells,2018.0,176
PXD007968,A quantitative mass spectrometry-based approach to monitor the dynamics of endogenous chromatin-associated protein complexes,2018.0,176
PXD003710,Peli1 knock-out and wild type mouse brain proteomes during the disease course of experimental autoimmune encephalomyelitis,2016.0,176
PXD006404,Proteomics analysis of ALK signaling in neuroblastoma cells,2017.0,176
PXD003089,"Mouse SJ, LC-MS/MS -  Proteome rearrangements after auditory learning: high-resolution profiling of synapse-enriched protein fractions from mouse brain",2015.0,176
PXD017286,Phosphoproteomic Datasets for Mec1/ATR Signaling Upon Hyper-Resection,2020.0,176
PXD000114,Metaproteomics of Premature Infant Gut Colonization,2012.0,176
PXD020406,Wild-type and O/E uPA in mouse aortic arches_PROTOMAP,2020.0,176
PXD004664,Genome-wide functional analysis of AreA and AreB,2016.0,176
PXD030354,The Transglutaminase-2 interactome in the APP23 mouse model of Alzheimer disease,2021.0,176
PXD013363,Quantitative proteomic analysis of SUMOylation in renal cortical collecting duct cells after aldosterone stimulation,2019.0,176
PXD030245,Protein folding stabilities are a major determinant of oxidation rates for buried methionine residues,2021.0,176
PXD017341,Titin BioID -  protein and peptide pull-down,2020.0,176
PXD008787,Efficient Parsing and Quantification of Native Mass Spectrometer Files with RawQuant,2018.0,176
PXD004989,PROTOTYPE OF THE CIRCULATING ACELLULAR PROTEOME OF HEALTHY SHEEP USING SERUM,2016.0,175
PXD004149,Personalized proteome profiles of healthy and tumor human colon organoids reveal both individual diversity and basic features of colorectal cancer.,2016.0,175
PXD022313,Simple and efficient micro-SPE tip-based sample preparation workflow to enable sensitive proteomic profiling of limited samples,2021.0,175
PXD011473,Understanding the physiological role of asparaginyl endopeptidase (AEP)/Legumain,2018.0,174
PXD008550,An integrated workflow for cross-linking/mass spectrometry,2018.0,174
PXD022624,Systemic metabolic alterations correlate with islet-level prostaglandin E2 production and signaling mechanisms that predict beta-cell dysfunction in a mouse model of type 2 diabetes,2020.0,174
PXD009219,The difference in serum proteomes in schizophrenia and bipolar disorder,2018.0,174
PXD027404,Mass spectrometry-based proteomics discovery of prognostic biomarkers in adrenal cortical carcinoma,2021.0,174
PXD009068,A generic normalization method for proper quantification in untargeted proteomics screening,2018.0,174
PXD005012,Identifying SAM-binding proteins in D.melanogaster,2016.0,174
PXD002150,An integrated systems biology approach reveals positive and negative effects of suberoylanilide hydroxamic acid (SAHA) on HIV reactivation from latency,2015.0,173
PXD008273,Workflow for metaproteome characterization in bronchoalveolar lavage fluid (BALF),2017.0,173
PXD010372,Multi-level proteomics identifies CT45 as a  chemosensitivity mediator and immunotherapy target in ovarian cancer,2020.0,173
PXD019381,An anatomic proteomic atlas of human glioblastoma,2020.0,172
PXD037031,Urinary endogenous peptides as biomarkers for prostate cancer,2022.0,172
PXD005573,Optimization of Experimental Parameters in Data-Independent Mass Spectrometry Significantly Increases Depth and Reproducibility of Results,2017.0,172
PXD037374,Biochemical and Structural Basif for Differential Inhibitor Sensitivity of EGFR with Distinct Exon 19 Mutaions,2022.0,172
PXD006245,Fishing for SAM/SAH-binding proteins,2017.0,172
PXD001212,A mammalian transcription factor-specific peptide repository for targeted proteomics,2014.0,172
PXD023243,Direct mapping of peptide-spectral-matches to genome information facilitates qualifying proteomics information,2020.0,172
PXD012720,Synovial fluid proteome changes in ACL injury-induced posttraumatic osteoarthritis: proteomics analysis of porcine knee synovial fluid,2019.0,172
PXD002668,Isolation of extracellular vesicles by PROSPR,2015.0,172
PXD028089,HMGB1 signaling phosphorylates Ku70 and impairs DNA damage repair in Alzheimer’s disease pathology,2021.0,172
PXD003607,Ovarian Cancer Proteomics of FFPE Tissue,2016.0,172
PXD026395,A comprehensive mass spectral library for human thyroid tissues,2021.0,172
PXD011088,PPR proteins in Arabidopsis mitoribosomes,2018.0,171
PXD013764,Human Milk Site-specific N-Glycoproteome Changes Across Lactation,2019.0,171
PXD015268,Proteomic investigation uncovers potential targets and target sites of pneumococcal serine-threonine kinase StkP and phosphatase PhpP,2019.0,171
PXD003935,Profiling of Human Circulating Plasma Microparticle Associated Proteins by DDA and DIA,2016.0,171
PXD000411,Proteomics of protein secretion by Aggregatibacter actinomycetemcomitans,2013.0,171
PXD019848,Integration of FAIMS on a Q-Exactive HF mass spectrometer,2020.0,171
PXD012924,Accurate quantitative proteomic analyses using metabolic labeling and High Field Asymmetric Waveform Ion Mobility Spectrometry (FAIMS),2019.0,171
PXD021932,A Metaproteomic Workflow for Sample Preparation and Data Analysis Applied to Mouse Faeces: 4,2020.0,170
PXD015835,A census of RNA/protein complexes in a model Gram-positive bacterium reveals exonuclease-mediated sRNA activation in competence regulation,2019.0,170
PXD030742,Universally available herbal teas based on sage and perilla elicit potent antiviral activity against SARS-CoV-2 variants of concern by HMOX-1 upregulation in human cells,2022.0,170
PXD024121,Extracellular vesicles as prognostic biomarkers for Multiple Myeloma - a clinical population-based study,2021.0,170
PXD020775,An integrated multi-omics protocol for swine feces reveals congruent longitudinal dynamics in microbiome structure and function.,2020.0,170
PXD005321,Alzheimer Disease (AD) and AD model detergent insoluble proteomes,2016.0,170
PXD000528,Melanoma NRAS -  Cooperative induction of apoptosis in nras mutant melanoma by inhibition of mek and rock,2015.0,170
PXD006722,Specter -  Specter: linear deconvolution for targeted analysis of data-independent acquisition mass spectrometry proteomics,2018.0,170
PXD028921,Tryptophan depletion provokes the production and presentation of in-frame tryptophan to phenylalanine substitutions,2021.0,170
PXD025265,Drivers genes in severe forms of COVID-19,2021.0,170
PXD036089,Mass Spectrometry identifies temporal changes and hallmarks of Delayed Recovery in the COVID19 Neutrophil proteomes part2,2022.0,170
PXD023266,Proteomic characterization of SGBS cells,2020.0,169
PXD017210,Predictive protein biomarker signatures and the corresponding transcriptional cell state changes in human lung fibrosis (Plasma),2020.0,169
PXD007162,The proteome of germlings from urediniospores of Puccinia triticina,2017.0,169
PXD031022,Neurodegeneration and humoral response proteins in cerebrospinal fluid associate with pediatric-onset multiple sclerosis -- Validation,2022.0,169
PXD016013,Data in support ofRapid proteome changes in plasma and cerebrospinal fluid following bacterial infection in preterm newborn pigs,2019.0,169
PXD025765,HDX-MS Analysis of RORg:RORE:SRC3 Complexes,2021.0,169
PXD007528,Global ion suppression limits the potential of mass spectrometry based phosphoproteomics,2017.0,169
PXD001890,Glioma-derived stem-like cells (GSCs): Quantitative Proteomics,2015.0,169
PXD014136,Changes to SUMO2 conjugation during Influenza virus infection of cultured cells,2019.0,169
PXD022367,MaxQuant.Live enables enhanced selectivity and identification of peptides modified by endogenous SUMO and ubiquitin,2020.0,169
PXD016563,Laser-capture proteomics of human FFPE substantia nigra,2020.0,169
PXD000490,"Proteomics reveals dynamic assembly of repair complexes during bypass of DNA cross-links, part 1 of 2: CHROMASS DATA",2015.0,169
PXD003249,"Outer membrane vesicle and outer membrane of Haemophilus influenzae Rd KW20, Rd ∆yrbE and Rd ∆vacJ",2015.0,168
PXD003239,Global Subcellular Characterization of Protein Degradation Using Quantitative Proteomics,2015.0,168
PXD006373,"Proteome-wide analysis of cysteine oxidation reveals metabolic sensitivity to redox stress, PART 3",2017.0,168
PXD009833,"Mitochondrial Network Organization during Neuronal Reprogramming, MT_DF_SEC",2018.0,168
PXD021076,Proteomics profiling of pediatric choroid plexus tumors,2020.0,168
PXD009834,"Mitochondrial Network Organization during Neuronal Reprogramming, MT_UDF_SEC",2018.0,168
PXD033347,Dynamics of protein phosphorylation during Arabidopsis seed germination,2022.0,168
PXD026546,An extracellular receptor tyrosine kinase motif orchestrating intracellular STAT activation,2021.0,168
PXD011162,Hepatomasys,2018.0,168
PXD011456,Global analysis of methionine oxidation provides a census of folding stabilities for the human proteome,2018.0,168
PXD027411,The Binary Toxin of Clostridioides difficile Alters the Proteome and Phosphoproteome of HEp-2 Cells,2021.0,168
PXD012058,Defining the T cell proteome and the role of mTORC1 during differentiation using quantitative proteomics,2018.0,168
PXD013003,Ubiquitin mediated intracellular trafficking is required for Jam-C function,2019.0,168
PXD020669,Improved sensitivity of ultra-low flow LC-MS-based proteomic profiling of limited samples using monolithic capillary columns and FAIMS technology,2020.0,168
PXD004465,Glycoproteomics reveals the presence of decorin peptides with anti-myostatin activity in human atrial fibrillation,2016.0,168
PXD030764,Proteome analysis of mixed fatty acid treated hepatocytes,2022.0,168
PXD014199,Phosphorylation of multiple proteins involved in ciliogenesis by Tau Tubulin kinase 2,2019.0,168
PXD025146,The global Proteome and Ubiquitinome of bacterial and viral co-infected Bronchial Epithelial Cells,2021.0,168
PXD016047,A comprehensive CHO SWATH-MS spectral library for accurate quantitative profiling of 10k proteins,2020.0,168
PXD017198,Evaluation of protein purification techniques and effects of storage duration on LC-MS/MS analysis of archived FFPE human CRC tissues,2020.0,168
PXD019594,Impact of ultrastructural left-ventricular Ca2+ release unit remodeling in hemodynamic subtypes of severe aortic stenosis,2020.0,168
PXD008619,Surface glycoproteome of BACE1-inhibited neurons,2018.0,168
PXD005093,Phosphoproteome of Tanshinone IIA treatment in Human gastric cell line AGS,2016.0,168
PXD017495,Acute experimental infection of bats and ferrets with Hendra virus: insights into the early host response of the reservoir host and susceptible model species,2020.0,168
PXD006372,"Proteome-wide analysis of cysteine oxidation reveals metabolic sensitivity to redox stress, PART 2",2017.0,168
PXD016002,Proteomic analysis of CSF from patients with leptomeningeal melanoma metastases identifies signatures associated with disease progression and therapeutic resistance,2019.0,168
PXD033935,Natural and cryptic peptides dominate the immunopeptidome of atypical teratoid rhabdoid tumors.,2022.0,167
PXD037803,Multienzyme deep learning models improve peptide de novo sequencing by mass spectrometry proteomics,2022.0,167
PXD004962,Quantitative Shotgun Proteomics Unveils Candidate Novel Oesophageal Adenocarcinoma-Specific Proteins,2016.0,167
PXD006236,Accumulated ion monitoring for improved sensitivity,2017.0,166
PXD008163,Depleted Prefractionated Human Plasma for Data Independent Acquisition Spectral Library,2017.0,166
PXD000574,Dectin-1/Syk pathway activates autophagy-dependent unconventional protein secretion from human macrophages,2013.0,166
PXD019847,Blue Native Page based separation of the TNFRSC,2020.0,166
PXD004608,Integrated cellular and plasma proteomics reveals common and systemic signatures in contrasting B-cell cancers,2016.0,166
PXD008960,Improvements to the rice genome annotation through large-scale analysis of RNA-Seq and proteomics data sets,2018.0,166
PXD011940,Vascular endothelial protein tyrosine phosphatase: Identification of novel cell junction-related substrates and a ternary receptor complex with EPHB4 and TIE2,2018.0,166
PXD009004,Triflic acid-treatment enables LC-MS/MS analysis of insoluble bacterial biomass,2018.0,166
PXD023932,ABHD17 regulation of plasma membrane palmitoylation and N-Ras-dependent cancer growth,2021.0,166
PXD010325,Pericentriolar satellite proteome,2019.0,165
PXD033644,Transforming chemical proteomics into high-throughput method using SP2E workflow.,2022.0,165
PXD014710,Towards middle-up analysis of polyclonal antibodies: subclass-specific N-glycosylation profiling of murine immunoglobulin G (IgG) by means of HPLC-MS,2019.0,165
PXD013300,"Systematic Discovery of Deeply Conserved Plant Protein Complexes, Wheat Germ.",2019.0,165
PXD027743,Quantitative fragmentomics to map affinities of interactomes,2021.0,165
PXD008324,"PTMs in yeast complexes - We investigate the roles of natively present PTMs on stability of interactions in three large and essential yeast Saccharomyces cerevisiae complexes: exosome, RNA polymerase II and 26S proteasome.",2017.0,165
PXD009139,Comparative serum proteomics of Intraductal papillary mucinous neoplasias and pacreatic adenocarcinoma,2018.0,165
PXD009307,RPL12 phosphorylation regulates translation during mitosis - ribo profile B cell -,2018.0,164
PXD005828,Proteomic of Hydra vulgaris,2017.0,164
PXD018977,Quantitative proteomics of coeliac gut during 14-day gluten challenge: low-level baseline inflammation despite clinical and histological normality predicts subsequent response,2020.0,164
PXD021539,Identification of drivers of breast cancer invasion by secretome analysis: insight into CTGF signaling,2020.0,164
PXD014792,PRMT5 methylome profiling uncovers a direct link to splicing regulation in human acute myeloid leukemia,2019.0,164
PXD007741,Identifying host factors associated with DNA replicated during virus infection,2017.0,164
PXD013608,NIST Candidate RM 8461 Human Liver for Proteomics,2019.0,164
PXD001108,Listeria monocytogenes phosphoproteomics,2014.0,164
PXD015422,High-resolution proteomics of Zika and Dengue serum samples,2019.0,164
PXD015209,Cathepsin B and Cathepsin Z tumor secretome of murine breast cancers,2019.0,164
PXD000514,Proteomic Analysis of olfactory cilia membranes,2017.0,163
PXD005873,Systemic perturbation of keratinocyte homeostasis,2017.0,163
PXD018110,Spatial proteomics defines the content of trafficking vesicles captured by golgin tethers,2020.0,163
PXD007974,Deep Multilayer Tissue Proteomics Identifies Molecular Networks in Alzheimer’s Disease Progression,2017.0,163
PXD020483,Quantitative PTM Maps of Human Pathologic Tau Identify Patient Heterogeneity and Define Critical Steps in Alzheimer’s Disease Progression - high/low molecular weight tau,2020.0,163
PXD003822,"Human AML patient samples, Method Optimization, LC-MSMS",2016.0,163
PXD036082,Mass Spectrometry identifies temporal changes and hallmarks of Delayed Recovery in the COVID19 Neutrophil proteomes ,2022.0,163
PXD034803,Glucose-dependent insulinotropic polypeptide effects in type 1 diabetes,2022.0,162
PXD006223,The proteomic landscape of patient-derived CD4+ T cells in recent-onset type 1 diabetes,2017.0,162
PXD031229,Knockdown of DHRS7 in LNCaP cells,2022.0,162
PXD003267,Changes in the plasma proteome of Manduca sexta larvae in relation to the transcriptome variations after an immune challenge: evidence for high molecular weight immune complex formation,2015.0,162
PXD008473,Shotgun proteomic profiling of head kidney of rainbow trout Oncorhynchus mykiss,2017.0,162
PXD004124,P falciparum gametocyte proteomes,2016.0,162
PXD021241,Bull plasma proteomes at different seasons,2021.0,162
PXD008821,"Confirmation of SOMAmer® Enrichment from Biological Matrices using Mass Spectrometry, plasma",2018.0,162
PXD029321,Anti-SARS-CoV-2 antibodies elicited by COVID-19mRNA vaccine exhibits a unique glycosylation pattern,2021.0,162
PXD010948,To invesigate the role of autophagy in Arabidopsis shoot cellular protein turnover and proteomstasis (15N Spike-in shoot),2018.0,162
PXD031916,Early response evaluation by single cell signaling profiling in acute myeloid leukemia,2022.0,162
PXD035447,Mass spectrometry-based analysis on the impact of iron status and whole blood donation on the global plasma proteome,2022.0,162
PXD010992,To invesigate the role of autophagy in Arabidopsis root cellular protein turnover and proteostasis (15N Spike-in root),2018.0,162
PXD007151,Global proteomic analysis of changes in the Caenorhabditis elegans proteome during Klebsiella pneumoniae infection,2017.0,162
PXD008307,Tandem mass tag (TMT) quantitative proteomics of human acute myeloid leukaemia (AML),2020.0,162
PXD017496,Global and site-specific effect of phosphorylation on protein turnover,2020.0,162
PXD036643,Proteome of Human hepatocellular carcinoma cell lines,2022.0,162
PXD002090,Development of a Mass Spectrometry-Based Quantitation Assay for Human Body Fluid Proteins using a Wheat Germ Cell-Free Synthesis System,2015.0,162
PXD006630,"Nε- and O-Acetylation in Mycobacterium tuberculosis Lineage 7 is Biased Towards Proteins Involved in Growth, Virulence and Antimicrobial Resistance",2017.0,162
PXD022115,Thermal proteome profiling of temporal dynamics of infection of SARS-CoV-2,2020.0,162
PXD000341,Site-specific quantitation of TCR-induced phosphorylation in Jurkat T cell lines,2013.0,162
PXD006092,StUbEx PLUS in U2OS,2017.0,162
PXD001861,platelet hyperreactivity project,2015.0,162
PXD002561,Identification of cell cycle dependent interaction partners of the septins by quantitative mass spectrometry,2015.0,162
PXD024674,The Trans-omics Landscape of COVID-19,2021.0,161
PXD029088,Phosphorylation of methyltransferase Set2p and demethylase Jhd1p and its association with histone H3K36 methylation and stress response pathways in Saccharomyces cerevisiae,2022.0,161
PXD003427,Mitotic chromatin proteomics -  Proteomics analysis with a nano Random Forest approach reveals novel functional interactions regulated by SMC complexes on mitotic chromosomes,2016.0,161
PXD029119,Eukaryotic catecholamine hormones influence the chemotactic  control of Vibrio campbellii by binding to the coupling protein CheW,2021.0,161
PXD010919,Protein Complex identification and quantitative complexome by CN-PAGE,2018.0,160
PXD029586,Analysis of protein secretome of human hepatocellular carcinoma (HCC) Cancer Associated Fibroblasts (CAFs) after long term (14 days) treatment with Transforming Growth Factor beta 1 (TGF beta 1),2021.0,160
PXD036014,Who’s bad? – Impact of pneumococcal and viral pneumonia on the respiratory and intestinal tract microbiome of mice,2022.0,160
PXD013552,Glucocorticoid treatment leads to aberrant ion and macromolecular transport mechanisms in regenerating zebrafish fins.,2019.0,160
PXD016587,Reduced proteasome activity in the aging brain results in ribosome stoichiometry loss and aggregation,2019.0,160
