"accession","title","year","file_count","Status", "Notes"
PXD024538,"Identification and drug-induced reversion of molecular signatures of Alzheimer´s disease onset and progression in AppNL-G-F, AppNL-F and 3xTg-AD mouse models",2021.0,288
PXD006382,Subregion-specific proteomic signature in the hippocampus for memory formation in adult mice,2017.0,286
PXD008495,The temporal profile of activity-dependent presynaptic phospho-signalling reveals a PP1-dependent reduction in vesicle release,2017.0,285
PXD017755,High-throughput Proteomics fiber typing (ProFiT) for comprehensive characterization of single skeletal muscle fibers,2020.0,285
PXD003109,UVPD applied to phosphoproteomics,2015.0,284
PXD027739,Release of a nuclear ubiquitin-like protein activates proteasomal degradation of mislocalized hydrophobic mitochondrial proteins in trypanosomes,2021.0,283
PXD030304,Pan-cancer proteomic map of 949 human cell lines (ProCan-DepMapSanger),2022.0,283
PXD003698,Identification of CDK8 and CDK19 substrates in human cells using cortistatin A and quantitative phosphoproteomics,2016.0,283
PXD025134,A combined metaproteomics and metabolomics approach for the in vivo analysis of cystic fibrosis sputum focusing on microbial pathogens,2021.0,282
PXD033383,The HLA-ligandome of oropharyngeal squamous cell carcinomas reveals shared tumor-exclusive peptides for semi-personalized vaccination,2022.0,282
PXD015701,Confident identification of citrullinated peptides from P gingivalis,2019.0,282
PXD003468,Incorporation of nonproteinogenic amino acids into bacterial proteome analyzed by unbiased quantitative MS of protein modifications,2016.0,282
PXD000198,Differential proteomics-based identification by MALDI-MSMS and nLC-MSMS of biomarkers in serum of patients with glaucoma,2013.0,282
PXD019188,Translation Error Clusters Induced by Aminoglycoside Antibiotics,2020.0,281
PXD011431,Insulin Induces Microtubule Stabilization and Regulates the Microtubule Plus-End Tracking Protein Network in Adipocytes,2019.0,281
PXD013593,"Identification and characterization of bioactive peptides in relation to different genotypes, production status and geographical region",2019.0,281
PXD021593,A proteomic-informed view of the changes induced by loss of cellular adherence: the example of mouse macrophages,2020.0,281
PXD009473,HDL proteome across 93 mouse strains,2018.0,281
PXD037268,Microbiome biomarkers for Improved  Screening of Anal Cance,2022.0,280
PXD003883,Protein profiling of Chlamydia trachomatis growth forms,2016.0,280
PXD017620,"Cross-linking mass spectrometry of yeast mitochondria grown on different carbon sources reveal Ndi1, Min8 and Pet9 associated with the electron transport chain",2020.0,280
PXD016521,Proteomic analysis of ∆4-CYB complex III mutant cybrids,2019.0,280
PXD011001,Phosphoproteomic profiling reveals a defined genetic program for osteoblastic lineage commitment of human bone marrow derived stromal stem cells,2018.0,280
PXD003093,Proteomic analysis of mouse oocytes identifies PRMT7 as reprogramming factor that replaces SOX2 in the induction of pluripotent stem cells,2016.0,280
PXD006299,Characterisation of protein ubiquitination using UbiSite technology,2017.0,280
PXD020764,Multiomic analysis implicates OXPHOS/fatty acid oxidation as a potential druggable target in platinum-resistant high grade serous ovarian cancer,2021.0,280
PXD016930,Towards reducing the immunogenic potential of wheat flour: silencing of alpha gliadin genes in a U.S. wheat cultivar,2020.0,280
PXD004326,Metabolic regulation of N-terminal acetylation in yeast,2016.0,280
PXD033849,"SMARCA2, VHL Binary and Ternary Complex formation with ACBi1, PROTAC1, and PROTAC2",2022.0,280
PXD001901,Dynamic proteomic profiling of extra-embryonic endoderm differentiation in mouse embryonic stem cells,2015.0,279
PXD016512,: Extensive Rewiring of the EGFR Network in Colorectal Cancer Cells Expressing Transforming Levels of KRASG13D,2019.0,279
PXD002486,Target identification for 11q13 amplicon,2015.0,279
PXD020859,Cross-linking mass spectrometry uncovers protein interactions and functional assemblies in synaptic vesicle membranes,2020.0,278
PXD000404,Comparative Proteome Profiling of Bovine and Human Staphylococcus epidermidis Strains to Search for Cell-surface Bound Factors with Plausible Roles in Virulence or Adaptation,2014.0,278
PXD000434,Erythrocyte Proteome & Terminome,2013.0,278
PXD004435,Transcription factor-SNP interactome for colorectal cancer risk loci,2016.0,277
PXD008663,Searching N-terminal modifications of proteins starting with Gly in Arabidopsis thaliana,2018.0,277
PXD002192,Proteomic identification of cysteine cathepsin substrates shed from the surface of cancer cells,2015.0,276
PXD016495,Proteomics on colorectal cancer MCTS upon OXPHOS inhibition,2019.0,276
PXD016664,Proteomic analysis of bronchoalveolar lavage fluid during invasive pulmonary aspergillosis in mice and humans,2020.0,276
PXD002810,miR-17-92 sustains lymphoma growth by fine-tuning MYC,2015.0,276
PXD002556,Comparative proteome analysis across non-small cell lung cancer cell lines,2015.0,276
PXD002929,Global Membrane Protein Interactome Analysis using In vivo Crosslinking and MS-based Protein Correlation Profiling,2015.0,276
PXD007635,The immunopeptidomic landscape of ovarian carcinoma,2017.0,275
PXD007163,Proteome-wide map of targets of T790M-EGFR-directed covalent inhibitors,2017.0,275
PXD005658,HIV-1 activates T cell signaling independently of antigen to drive viral spread,2017.0,275
PXD003031,Phosphorylation of Asc1p and Asc1p-dependent phospho-proteome,2016.0,274
PXD000612,Ultra-deep human phosphoproteome reveals different regulatory nature of Tyr and Ser/Thr-based signaling,2014.0,273
PXD003511,N-acetylation in Acinetobacter baumannii,2016.0,273
PXD012724,Rapid Assay of Individual Microbiome responses to drugs part1,2019.0,273
PXD007841,Comparative analysis of mRNA degradation and protein degradation in 68 pairs of adjacent prostate tissue samples indicates high stability of proteins,2017.0,272
PXD031962,Hydrogen-deuterium exchange mass spectrometry of wt Mtr4 with various RNA substrates,2022.0,272
PXD014666,Decoding the genomic basis of osteoarthritis,2020.0,271
PXD006333,iTRAQ-MRM approach identify plasma biomarkers of atherosclerosis and myocardial injury,2017.0,271
PXD022465,Characterization of epiploic adipose tissue,2020.0,270
PXD021684,Proteomic Adaptation of Clostridioides difficile to Treatment with the Antimicrobial Peptide Nisin,2020.0,270
PXD014455,A sulfur-containing volatile emitted by potato-associated bacteria confers protection against late blight through direct anti-oomycete activity,2019.0,270
PXD001250,Cell-type and brain-region resolved mouse brain proteome,2015.0,270
PXD007934,Hyper-specialized Bacteroidetes selfishly compete for laminarin in microalgal blooms,2017.0,270
PXD030372,Sod1 Integrates Oxygen Availability to Redox Regulate NADPH Production and the Thiol Redoxome,2021.0,270
PXD009117,C2 skeletal myotube phosphoproteome,2018.0,270
PXD000164,A Metaproteomics Approach to Elucidate Host and Pathogen Protein Expression during Catheter-Associated Urinary Tract Infections,2015.0,270
PXD030094,De Novo Sequencing of SARS-CoV-2 and influenza monoclonal antibodies by mass spectrometry using HCD and EThcD fragmentation and Supernovo software,2021.0,268
PXD012520,Evosep One Enables Robust Quantitative Deep Proteome Coverage using Tandem Mass Tags while Significantly Reducing Machine Time,2019.0,268
PXD011617,PRMT1-mediated methylation of the Large Drosha Complex regulates microRNA biogenesis,2019.0,268
PXD011330,Assessing Technical and Biological Variation in SWATH-MS -based Proteomics: A case study in Chronic Lymphocytic Leukaemia,2018.0,268
PXD002545,Phosphoproteomic studies of role of LAR protein tyrosine phosphatase in mouse embryonic fibroblasts,2016.0,267
PXD021559,DIA-based systems biology approach unveils novel E3-dependent responses to a metabolic shift,2020.0,267
PXD027602,proteomic landscape of urothelial tumor,2021.0,267
PXD020029,Differential impact of BTK active site inhibitors on the conformational state of full-length BTK,2020.0,267
PXD032843,Multi-omics analysis identifies drivers of protein phosphorylation,2022.0,267
PXD037297,Chemoproteomic profiling to identify activity changes and functional inhibitors of DNA-binding proteins,2022.0,266
PXD004880,Proteome dysregulation in Down syndrome reveals organelle specific aberrations,2016.0,266
PXD024689,Analysis of barley chromosomal proteome: a multiapproach exploration of flow cytometry-sorted mitotic chromosomes,2021.0,266
PXD005234,"In vivo and in vitro proteome analysis of HIV-1 infected, human CD4+ T cells",2016.0,266
PXD006475,Global phosphoproteome analysis of human bone marrow reveals predictive phosphorylation markers for the treatment of acute myeloid leukemia with quizartinib,2017.0,266
PXD004763,Proteome analysis of Arabidopsis thaliana circadian clock mutants,2016.0,265
PXD005612,Capturig the Asc1p/RACK1 microenviroment at the head region of the 40S ribosome with quantitative BioID,2017.0,265
PXD010200,Environment-driven changes of mRNA and protein levels in Pseudomonas aeruginosa,2018.0,265
PXD033169,Novel Diagnostic Biomarkers for High-Grade Serous Ovarian Cancer Uncovered by Data-Independent Acquisition Mass Spectrometry,2022.0,265
PXD023835,The regulatory landscape of the human HPF1- and ARH3-dependent ADP-ribosylome (part 1),2021.0,264
PXD007235,Extensive and systematic rewiring of histone post-translational modifications in cancer model systems,2018.0,264
PXD038862,A library of novel Cancer Testis specific T cell receptors for T cell receptor gene therapy,2022.0,264
PXD017740,A proteomic architectural landscape of the healthy and aging human intervertebral disc,2020.0,264
PXD010027,Mutations in disordered regions cause disease by creating dileucine motifs - peptide-protein interaction screen,2018.0,264
PXD001536,"Fast Profiling of Protease Specificity reveals similar substrate specificities for cathepsins K, L and S",2014.0,264
PXD007748,Populus Drought Stress -  Quantitative proteome profile of water deficit stress responses in eastern cottonwood (Populus deltoides) leaves,2017.0,264
PXD016004,Neuronal proteome dynamics during homeostatic scaling.,2019.0,264
PXD032913,"Phosphoproteomics reveals rewiring of the insulin 
signaling network and multi-nodal defects in insulin 
resistance",2022.0,264
PXD007051,Phosphoproteomics reveals network rewiring to a pro-adhesion state in Annexin-1-deficient mammary epithelial cells,2017.0,263
PXD002529,Milk bottom-up proteomics: method optimisation.,2015.0,263
PXD016618,O-glycan initiation directs distinct biological pathways and controls epithelial differentiation,2019.0,263
PXD014556,Automated sample preparation with SP3 for low-input clinical proteomics,2019.0,262
PXD014422,Proteome analysis of PC12 cells reveals alterations in translation regulation and actin signalling induced by clozapine,2019.0,262
PXD017199,DECIPHERING THE SIGNALING NETWORK LANDSCAPE OF BREAST CANCER IMPROVES DRUG SENSITIVITY PREDICTION,2020.0,262
PXD027265,A universal peptide matrix interactomics approach to disclose motif dependent protein binding,2021.0,262
PXD008539,Lamin A acetylation shapes nuclear architecture and safeguards genomic integrity,2017.0,261
PXD002619,Proteomic maps of breast cancer subtypes,2015.0,261
PXD016674,Multi-omics profiling of non-small cell lung cancer patient-derived xenografts reveals proteome and phosphoproteome remodeling associated with patient outcome,2019.0,261
PXD000678,A Proteomic Chronology of Gene Expression through the Cell Cycle in Human Myeloid Leukemia Cells.,2014.0,260
PXD009121,“Trading virulence forsurvival”:Metabolic pathway switch is a key mechanism for survival of Macrophomina phaseolina upon Burkholderia contaminans challenge,2018.0,260
PXD024696,Quantitative proteomics identifies secreted diagnostic biomarkers as well as tumor-dependent prognostic targets for clear cell Renal Cell Carcinoma,2021.0,260
PXD000445,Proteomic profiling of colorectal adenomas,2014.0,259
PXD009852,A carcinogenic trigger to study the function of tumor suppressor genes in Schmidtea mediterranea,2018.0,259
PXD010209,"Rat Liver HFD vs Chow, HFD vs PKCepsilon ASO",2018.0,259
PXD007600,Arabidopsis diurnal LFQ proteome and  labelled phosphoproteome,2017.0,259
PXD012179,Identification of novel CSF biomarkers in GRN-associated frontotemporal dementia by proteomics,2018.0,258
PXD007787,"Proteomic analysis of cell cycle progression in asynchronous cultures, including mitotic subphases, using PRIMMUS",2017.0,258
PXD023015,The self-peptide repertoire plays a critical role in transplant tolerance induction,2020.0,258
PXD022695,The self-peptide repertoire plays a critical role in transplant tolerance induction,2020.0,258
PXD002434,Deep Proteomic Profiling of Vasopressin-Sensitive Collecting Duct Cells,2015.0,257
PXD012001,Systems level analysis of epithelial to mesenchymal transition reveals more alteration in phosphoproteome than proteome and identifies DNAJB4 and CD81 as EMT regulators,2018.0,257
PXD018712,The Human Telomeric Proteome During Telomere Replication,2020.0,256
PXD015794,Identification of chloroplast envelope proteins with critical importance for cold acclimation,2019.0,256
PXD007919,"Matched Lung Tumor And Emphysematous Matrix Proteomics, Transcriptomics, and Translatomics",2017.0,256
PXD012229,Post-translational Regulation of FNIP1:  a Rheostat for the  Molecular Chaperone Hsp90,2019.0,256
PXD000888,Anoxia in Ralstonia eutropha H16,2014.0,256
PXD009493,D2Ome - rate constant estimation from heavy water metabolic labeling and LC-MS,2018.0,256
PXD023195,"N-terminal acetylation in Arabidopsis thaliana, and the effects of Naa10/15 or HypK knock-outs",2020.0,256
PXD025791,Specialised skin cancer library spectral library for use in data independent mass spectrometry,2021.0,256
PXD004575,Serum proteomics in prostate cancer patients vs. healthy and benign prostate hyperplasia,2016.0,256
PXD027894,Cross-species analysis of viral nucleic acid interactors identifies TAOKs as immune regulators,2021.0,256
PXD001765,Time and compartment resolved proteome profiling of the extracellular niche in lung injury and repair,2015.0,255
PXD014799,PRMT1 controls the Senescence Associated Secretory Phenotype in Replication Stress Response,2019.0,255
PXD008822,"Confirmation of SOMAmer® Enrichment from Biological Matrices using Mass Spectrometry, serum",2018.0,255
PXD018049,Feedback regulation in EGFR signaling involves IRF2BP proteins and temporal control by (de)SUMOylation,2020.0,254
PXD019247,Optimization of a Top-Down Proteomics Platform for Closely-Related Pathogenic Bacteria Discrimination,2020.0,254
PXD001403,Proteome profiling of ovarian cancer and cirrhosis ascites,2014.0,254
PXD001590,Metaproteomics of Optimal vs Suboptimal Biocathode (MCL),2015.0,254
PXD003159,Heptad-specific phosphorylation of RNA polymerase II CTD,2015.0,254
PXD020564,Protein phosphorylation in depolarized synaptosomes,2020.0,253
PXD029702,Aeromonas hydrophila whole cell differential proteins,2021.0,253
PXD016492,"Phosphoproteomic analysis of cardiac biowires, cardiac hypertrophy patient explants, and hypertrophic mouse heart",2019.0,253
PXD007066,Proteomics Analysis of Human Breast Milk to Assess Breast Cancer Risk,2017.0,253
PXD019884,Glycan-induced structural dynamics in human norovirus P dimers depend on the virus strain and deamidation status,2020.0,253
PXD029828,Proteomic signatures of antimicrobial resistance in Yersinia pestis and Francisella tularensis,2021.0,253
PXD011198,hSWATH: Unlocking SWATH’s full potential for an untargeted histone perspective,2019.0,253
PXD002144,Label-free quantitative proteomics reveals a role for the Mycobacterium tuberculosis SecA2 pathway in exporting solute binding proteins and Mce transporters to the cell wall,2015.0,252
PXD036826,Deep Phosphoproteomic Elucidation of Metformin-Signaling in Heterogenous Colorectal Cancer Cells,2022.0,252
PXD015398,Impact of abacavir and abacavir analogues on HLA-B*57:01 peptide presentation,2019.0,252
PXD006674,Comparative degradomics of porcine and human wound exudates unravels biomarker candidates for assessment of wound healing progression in trauma patients,2017.0,252
PXD023354,Altered Transcription Factor Expression Responses to Exercise in Insulin Resistance,2021.0,252
PXD013073,NanoBlow: A simple device to limit contaminants during nanoLC-MS,2019.0,252
PXD011401,Asian citrus psyllid proteomics: Shotgun MS/MS analysis of impact of plant host on insect proteome + DIGE analysis of impact of plant host on insect proteome,2018.0,252
PXD010271,Individual variability of protein expression in human tissues,2018.0,252
PXD008173,Proteomic profiling in mouse kidneys post-UUO,2017.0,252
PXD001064,Quantitative variability of 342 plasma proteins in a human twin population,2015.0,252
PXD000567,Protein abundance changes and ubiquitylation targets identified upon inhibition of the proteasome with Syringolin A,2014.0,252
PXD008722,Quantitative proteomics of human heart samples collected in vivo reveal the remodeled protein landscape of dilated left atrium without atrial fibrillation.,2020.0,252
PXD002091,Positional proteomics reveals differences in N-terminal proteoform stability.,2015.0,252
PXD016425,Landscapes of post-translational modifications in Trypanosoma parasites,2019.0,252
PXD001065,"Compartment resolved reference map from highly purified naive, activated, effector and memory CD8+ cells",2014.0,251
PXD012317,Platform independent protein-based cell-of-origin subtyping of diffuse large B-cell lymphoma in formalin-fixed paraffin-embedded tissue,2019.0,251
PXD000143,Dynamic readers for 5-(hydroxy)methylcytosine and its oxidized derivatives,2013.0,251
PXD028274,Matrix and sampling effects on quantification of protein biomarkers of drug-induced liver injury,2021.0,250
PXD008017,More is not always better: Evaluation of 1D- and 2D-LC-MS2 methods for metaproteomics,2018.0,250
PXD005461,Galectin-1 and Galectin-3 interactors,2016.0,250
PXD000376,A Multi-Omic Analysis of Human Naive CD4 T cells,2015.0,249
PXD000145,Zebrafish embryo gene and protein expression comparison,2016.0,249
PXD030338,Tyr62 phosphorylation of the phosphatase SHP2 enables acquired resistance to SHP2 allosteric inhibitors in FLT3-ITD-driven AML,2021.0,248
PXD004927,Site-specific mapping of the human SUMO proteome reveals co-modification with phosphorylation (part 1),2016.0,248
PXD003496,Identification of the UT-A1 Urea Channel Interactome,2016.0,248
PXD001488,"Protein 2DE reference map of Rhodnius prolixus's anterior midgut, part 1",2015.0,247
PXD023374,A Universal 384-Well Proteomic Sample Preparation Platform for High-Throughput Screening and Biomarker Discovery,2021.0,247
PXD012133,Evaluating cPILOT Performance on Orbitrap Instruments,2018.0,247
PXD028857,Evaluate gut microbiome biobanking,2021.0,247
PXD025391,A3G-Vif-CBFB-CRL5 Cross-Linking with DSSO,2021.0,247
PXD034044,The HLA peptide repertoire of SaOS-2 cell line transfected with TP53 protein,2022.0,246
PXD011263,Investigating Lactococcus lactis MG1363 response to phage p2 infection  at the proteome level,2018.0,246
PXD019654,Methyl-SILAF mapping of the Drosophila mitochondrial protein methylome,2020.0,246
PXD005681,Mouse Liver LC-MSMS -  Food Perception Primes Hepatic ER Homeostasis via Melanocortin-Dependent Control of mTOR Activation,2017.0,246
PXD029548,High-Resolution Complexome-Profiling of Mitochondria Reveals Quality Control Pathways of Protein Import,2021.0,245
PXD017269,A streamlined mass spectrometry-based proteomics workflow for large scale FFPE tissue analysis,2020.0,245
PXD006171,Phosphoproteome and proteome of T. cruzi metacyclogenesis,2017.0,245
PXD015751,Cellular interactome dynamics during paclitaxel treatment,2019.0,245
PXD005785,The effect of chronic inflammation on molecular pathways of long-term potentiation in an APP/PS1 mouse model of Alzheimer Disease,2017.0,245
PXD000429,The Aeromonas salmonicida subsp. salmonicida exoproteome.,2013.0,245
PXD001973,Proteome Comparison of Different-Aged Cochlea,2015.0,244
PXD025365,"Rapid detection of beta-lactam, aminoglycoside and fluoroquinolone resistance mechanisms in blood cultures positive for E. coli or K. pneumoniae using targeted LC-MS/MS",2021.0,244
PXD011137,Schistosoma haematobium proteomes,2018.0,244
PXD019384,Industrial Malting SWATH-MS proteomics,2020.0,244
PXD013585,Musashi interaction with poly(A) binding protein is required for activation of target mRNA translation,2019.0,244
PXD008626,"2 Dimensional Thermal proteome profiling of JQ1",2018.0,243
PXD035195,A core UPS molecular complement implicates unique endocytic compartments at the parasite-host interface in Giardia lamblia – crosslinking IP conditions,2022.0,243
PXD014311,Region-specific proteome changes of the intestinal epithelium during aging and dietary restriction,2020.0,242
PXD008443,Serum proteomics in early onset breast cancer,2017.0,242
PXD000222,Comparative Phosphoproteomic Analysis of G2-checkpoint Recovery,2013.0,242
PXD037355,The structural dynamics of EGFR exon 19 mutants,2022.0,242
PXD031726,TcdB of Clostridioides difficile mediates necrosis in epithelial cells and is depend on RAS,2022.0,242
PXD024525,Beta-blocker/ACE inhibitor therapy differentially impacts the steady state signaling landscape of failing and non-failing hearts.,2021.0,242
PXD000942,"Differences in proteasome targeting in Arabidopsis leaf mesophyll, epidermal and vascular cells",2014.0,241
PXD031831,RIGI autoimmune variants conformational changes,2022.0,241
PXD007156,Identification of Long Lived Synaptic Proteins by Comprehensive Proteomic Analysis of Synaptosome Protein Turnover,2017.0,241
PXD018703,Dynamic Palmitoylation Events Following T-Cell Receptor Signaling,2020.0,241
PXD005497,METTL21B is a novel human lysine methyltransferase of translation elongation factor 1A: discovery by CRISPR/Cas9 knock out,2017.0,241
PXD021831,A comprehensive landscape of 60S ribosome biogenesis factors,2020.0,240
PXD021109,Global Phosphoproteomics Pinpoints Uncharted Gcn2-Mediated Modes of Translational Control,2020.0,240
PXD009924,Influenza A virus induced proteome changes,2018.0,240
PXD001183,Proteomic characterisation of microtubule-dependent modulation of adhesion complexes,2014.0,240
PXD033418,Metaproteome plasticity sheds light on the ecology of the rumen microbiome and its connection to host traits,2022.0,240
PXD016105,"Proteome of naive and TCR activated wild-type, Myc-deficient and Slc7a5-deficient T cells",2019.0,240
PXD022830,Differences in gene expression between colony and aggregate biofilms of Clostridioides difficile revealed by proteomic profiling,2020.0,240
PXD004810,Global phosphoproteomic profiling reveals perturbed signaling in a  mouse model of dilated cardiomyopathy,2016.0,240
PXD004970,Proteomics profiles of prostate cancer cell lines,2016.0,240
PXD000778,"Mouse SCN in LC-MSMS - The suprachiasmatic nucleus (SCN) acts as the central clock to coordinate circadian oscillations in mammalian behavior, physiology and gene expression. Despite our knowledge of the circadian transcriptome of the SCN, how it impacts genome-wide protein expression is not well understood. Here, we interrogated the murine SCN proteome across the circadian cycle using SILAC-based quantitative mass spectrometry.",2014.0,240
PXD010760,Exosomal transport of hepatocyte-derived drug-modified proteins to the immune system,2018.0,240
PXD027742,A deeper look at carrier proteome effects for single-cell proteomics,2021.0,240
PXD017614,Heart mitochondria from CLPP knockout Mouse Complexome Profiling experiment,2020.0,240
PXD033586,The marine Bacteroidetes Muricauda sp. MAR_2010_75 digests diatom β-mannan,2022.0,240
PXD010630,Improvement of Peptide Separation for Exploring the Missing Proteins Localized on Membranes,2018.0,240
PXD000901,Phospho-networks in Ovarian Cancer Cell Lines,2014.0,240
PXD033778,Global proteomic profiling of multiple organs of cat (Felis catus) and proteome-transcriptome correlation during acute Toxoplasma gondii infection,2022.0,240
PXD001685,A Combined Shotgun and Targeted Mass Spectrometry Strategy for Breast Cancer Biomarker Discovery,2015.0,240
PXD016733,Complexome profiling of mitochondrial protein complexes in single and double MIC26 and MIC27 knockout cells,2019.0,240
PXD014087,Proteomics analysis of pancreatic cancer cell line (MiaPaCa-2),2019.0,240
PXD035588,Elucidating colony bloom formation mechanism of a harmful alga Phaeocystis globosa (Prymnesiophyceae) using metaproteomics,2022.0,240
PXD001500,Quantitative proteomics of Hematopoietic Stem Cells during acute inflammation,2014.0,240
PXD011483,Protein disaggregation by HSP101,2018.0,240
PXD003442,Integrated genomics and proteomics to define huntingtin CAG length-dependent molecular networks in HD mouse brains,2016.0,240
PXD011181,Rat atria-2D LC-MS/MS -  Atrial electrophysiological and molecular remodelling induced by obstructive sleep apnoea,2018.0,240
PXD000155,Proteomic analysis of integrin activation-state-dependent adhesion complexes,2013.0,240
PXD001648,Characterization of the E.coli proteome and its modifications during growth and ethanol stress,2015.0,240
PXD023209,Comprehensive analysis of the host-virus interactome of SARS-CoV-2,2020.0,240
PXD017932,Identification and quantification of small proteins and peptides in Staphylococcus aureus,2020.0,240
PXD018833,"Overexpression of sedoheptulose-1,7-bisphosphatase enhances photosynthesis in Chlamydomonas reinhardtii and has no effect on the abundance of other Calvin-Benson cycle enzymes",2020.0,240
PXD014759,Optimized parameter settings enhance proteome-wide formation of crosslinks on low-abundant proteins,2019.0,240
PXD005183,Systematic Evaluation of Protein Reduction and Alkylation reveals Massive Unspecific Side Effects by Iodine-containing Reagents,2017.0,240
PXD001505,Leukaemic protein tyrosine kinase comparison in Ba/F3 cells,2014.0,240
