cell line	cellosaurus name	cellosaurus accession	bto cell line	organism	organism part	sampling site	age	developmental stage	sex	ancestry category	disease	cell type	Material type	synonyms	curated
MGH358	no available	no available	no available	Homo Sapiens	Breast	Breast	no available	Adult	Female	no available	Breast Cancer	epithelial	cell	MGH358	curated
MGH312	no available	no available	no available	Homo Sapiens	Breast	Liver	no available	Adult	Female	no available	Breast Cancer	epithelial	cell	MGH312	curated
hTERT-HME1	hTERT-HME1	CVCL_3383	no available	Homo Sapiens	Breast	Breast	53Y	Adult	Female	no available	Non-cancerous	epithelial	cell	hTERT-HME-1; hTERTHME1; HME-1; HME1; ME16C; hME1	curated
PDX1206	no available	no available	no available	Homo Sapiens	Breast	Breat	no available	no available	Female	no available	Breast Cancer	epithelial	cell	PDX1206	curated
PDX1258	no available	no available	no available	Homo Sapiens	Breast	Breat	no available	no available	Female	no available	Metaplastic triple negative breast cancer	epithelial	cell	PDX1258	curated
PDXHCI002	no available	no available	no available	Homo Sapiens	Breast	Breat	no available	no available	Female	no available	Invasive ductal carcinoma	epithelial	cell	PDXHCI002	curated
HL-60	HL-60	CVCL_0002	HL-60 cell	Homo Sapiens	Blood	Peripheral blood	36Y	Adult	Female	Caucasian	Acute myeloid leukemia	no available	cell	HL60; NAN; HL 60; HL60 CELL; HL.60; HUMAN LEUKEMIA-60	curated
K-562	K-562	CVCL_0004	K-562 cell	Homo Sapiens	Haematopoietic and Lymphoid	Pleural effusion	53Y	Adult	Female	Caucasian	 bcr-abl1 positive; Chronic myelogenous leukemia	no available	cell	GM05372E; K562WT CELL; K562; K562 CELL; K 562; KO; K562S CELL; GM05372; K-562/S CELL; K.562	curated
NB4	NB4	CVCL_0005	NB-4 cell	Homo Sapiens	Bone Marrow	Bone marrow	23Y	Adult	Female	Caucasian	Acute myeloid leukemia	no available	cell	NB4 CELL; NB-4; NB.4	curated
THP-1	THP-1	CVCL_0006	THP-1 cell	Homo Sapiens	Blood	Peripheral blood	1Y	Infant	Male	Japanese	Childhood acute megakaryoblastic leukemia	no available	cell	O-THP-1; THP-1-O; NAN; THP-1(ATCC); TOHOKU HOSPITAL PEDIATRICS-1; THP1 CELL; THPI; THP1; THP 1	curated
U-937	U-937	CVCL_0007	U-937 cell	Homo Sapiens	Haematopoietic and Lymphoid	Pleural effusion	37Y	Adult	Male	Caucasian	Adult acute monocytic leukemia	no available	cell	U937; U937 CELL; U 937	curated
Daudi	Daudi	CVCL_0008	DAUDI cell	Homo Sapiens	Blood	Peripheral blood	16Y	Juvenile	Male	African; Kenyan	Burkitt lymphoma	B cell	cell	NAN; N; DAUDI; NK-10A; GM03190; GM17346; GM3190; GM03190A; NK10A; NK 10A	curated
HDLM-2	HDLM-2	CVCL_0009	no available	Homo Sapiens	Haematopoietic and Lymphoid	Pleural effusion	74Y	Elderly	Male	Caucasian	Hodgkins lymphoma	no available	cell	HD-LM-2; HDLM2	curated
LP-1	LP-1	CVCL_0012	LP-1 cell	Homo Sapiens	Blood	Peripheral blood	56Y	Adult	Female	Caucasian	Plasma cell myeloma	no available	cell	LP1 CELL; LP1	curated
MOLT-4	MOLT-4	CVCL_0013	MOLT-4 cell	Homo Sapiens	Blood	Peripheral blood	19Y	Adult	Male	Caucasian	Adult t acute lymphoblastic leukemia	T cell	cell	MOLT4 CELL; MOLT4; MOLT-4; GM02219; MOLT 4; GM2219C; GM02219C; MOLT.4; GM02219D	curated
U-698-M	U-698-M	CVCL_0017	no available	Homo Sapiens	Haematopoietic and Lymphoid	Tonsil	7Y	Children	Male	Caucasian	Lymphoblastic lymphoma	B cell	cell	U-698M; U698; U698-M; U-698; U-698 M; U698M	curated
D-341MED	D341 Med	CVCL_0018	no available	Homo Sapiens	Brain	Cerebellum	3Y	Children	Male	Caucasian	Medulloblastoma non-wnt/non-shh group 3	no available	cell	D341; D-341MED; D-341 MED; D341_MED; D341MD; D-341; D-341 MED-C; H341; MED 341; D341MED	curated
SH-SY5Y	SH-SY5Y	CVCL_0019	SH-SY5Y cell	Homo Sapiens	Peripheral Nervous System	Bone marrow	4Y	Children	Female	Caucasian	Neuroblastoma	no available	cell	SK-SH-SY5Y CELL; SH-SY5Y; SY5Y CELL; SK-SH-SY5Y; SHSY5Y; NAN; SY5Y; SK-N-SH-SY5Y CELL; SHSY-5Y CELL; SHSY-5Y; SH-SY5Y PARENTAL	curated
U-138-MG	U-138MG	CVCL_0020	U-138MG cell	Homo Sapiens	Brain	Brain	47Y	Adult	Male	Caucasian	Glioblastoma	no available	cell	U138-MG; U-138 MG CELL; U-138-MG; U-138 MG; U-138 CELL; 138 MG; U138MG CELL; U138MG; 138MG; U 138 MG; U138	curated
U251	U-251MG	CVCL_0021	U-251MG cell	Homo Sapiens	Brain	Parietal lobe	75Y	Elderly	Male	Caucasian	Brain astrocytoma	no available	cell	U-251MG; U251-MG; 251MG; U251; U-251; 251 MG; U-251 MG CELL; U-251_MG; U-251 CELL; U-251 MG; 251 MG(6); U-251MG CELL; U251MG; U251 CELL; U251N; U251MG CELL; U-251-MG	curated
U-87-MG	U-87MG ATCC	CVCL_0022	U-87MG cell	Homo Sapiens	Brain	Brain	no available	no available	Male	Caucasian	Glioblastoma	no available	cell	U-87MG CELL; U-87MG ATCC; U-87MG; 87MG; U-87 CELL; U87; U-87 MG CELL; U87MG; U-87-MG; U-87; U-87-MG CELL; U87 CELL; U87-MG CELL; 87 MG; U87-MG; U87 MG; U87MG CELL; U-87 MG	curated
A549	A-549	CVCL_0023	A-549 cell	Homo Sapiens	Lung	Lung	58Y	Adult	Male	Caucasian	Lung adenocarcinoma	no available	cell	A549; A549 CELL; HA549; A549ATCC; NCI-A549; A549 ATCC; NCI-A549 CELL; A549/ATCC; A 549	curated
SCLC-21H	SCLC-21H	CVCL_0024	no available	Homo Sapiens	Lung	Pleural effusion	46Y	Adult	Male	Caucasian	Small cell lung carcinoma	no available	cell	SCLC21H	curated
Caco-2	Caco-2	CVCL_0025	CACO-2 cell	Homo Sapiens	Colon	Colon	72Y	Elderly	Male	Caucasian	Colon adenocarcinoma	no available	cell	CACO-2; CACO 2; CACO-2/ATCC; CACO2; CACO-II; CACO-2 CELL	curated
CAPAN-2	Capan-2	CVCL_0026	CAPAN-2 cell	Homo Sapiens	Pancreas	Pancreas	56Y	Adult	Male	Caucasian	Pancreatic ductal adenocarcinoma	no available	cell	CAPAN2; CAPAN 2; CAPAN-2	curated
Hep-G2	Hep-G2	CVCL_0027	Hep-G2 cell	Homo Sapiens	Liver	Liver	15Y	Juvenile	Male	Caucasian	Hepatoblastoma	no available	cell	HEPG2; HEPG2 CELL; HEP-G2; HEP G2	curated
AN3-CA	AN3-CA	CVCL_0028	AN3CA cell	Homo Sapiens	Endometrium	Lymph node	55Y	Adult	Female	Caucasian	Endometrial adenocarcinoma	no available	cell	AN3; AN3 CA; AN3CA; AN3_CA; AN-3; ACANTHOSIS NIGRICANS 3RD ATTEMPT-CARCINOMA	curated
EFO-21	EFO-21	CVCL_0029	no available	Homo Sapiens	Ovary	Ascites	56Y	Adult	Female	Caucasian	Ovarian serous cystadenocarcinoma	no available	cell	EFO21; EFO 21	curated
HeLa	HeLa	CVCL_0030	HeLa cell	Homo Sapiens	Uterus; Cervix	Cervix; Uterus	30Y6M	no available	Female	African American	Human papillomavirus-related cervical adenocarcinoma	epithelial	cell	HELA; HELA; Hela; He La; He-La; HeLa-CCL2; Henrietta Lacks cells; Helacyton gartleri	curated
MCF7	MCF-7	CVCL_0031	MCF-7 cell	Homo Sapiens	Breast	Pleural effusion	69Y	Elderly	Female	Caucasian	Invasive breast carcinoma	no available	cell	SSMCF-7; MCF7/WT; NAN; SSMCF7; MCF7 CELL; MCF7-CTRL; MCF 7; MICHIGAN CANCER FOUNDATION-7; IBMF-7; MCF.7; MCF7	curated
SiHa	SiHa	CVCL_0032	SiHa cell	Homo Sapiens	Cervix	Uterus	55Y	Adult	Female	Japanese	Human papillomavirus-related squamous cell carcinoma	no available	cell	SIHA; NAN	curated
SK-BR-3	SK-BR-3	CVCL_0033	SK-BR-3 cell	Homo Sapiens	Breast	Pleural effusion	43Y	Adult	Female	Caucasian	Breast adenocarcinoma	no available	cell	SK BR 03; NAN; SK-BR3; SKBR-3 CELL; SK-BR-3; SKBR-3; SKBR3; SK-BR3 CELL; SKBR3 CELL	curated
PC-3	PC-3	CVCL_0035	PC-3 cell	Homo Sapiens	Prostate	Bone	62Y	Adult	Male	Caucasian	Prostate carcinoma	no available	cell	NAN; PC.3; PC3 CELL; PC3	curated
RT4	RT-4	CVCL_0036	RT-4 cell	Homo Sapiens	Bladder	Urinary bladder	63Y	Adult	Male	Caucasian	Bladder carcinoma	no available	cell	RT4 CELL; RT4P; RT4	curated
A431	A-431	CVCL_0037	A-431 cell	Homo Sapiens	Skin	Epidermis	85Y	Elderly	Female	Caucasian	Skin squamous cell carcinoma	no available	cell	NAN; A431 CELL; A431; A431/P	curated
HaCaT	HaCaT	CVCL_0038	HaCaT cell	Homo Sapiens	Skin	Skin; Epidermis; Back	62Y	Adult	Male	Caucasian	no available	keratinocyte	cell	NAN; HACAT	curated
SK-MEL-30	SK-MEL-30	CVCL_0039	SK-MEL-30 cell	Homo Sapiens	Skin	no available	67Y	Elderly	Male	Caucasian	Cutaneous melanoma	no available	cell	SK-MEL-30; SKMEL30; SK MEL 30; SKMEL-30; AW-MEL; SK MEL30	curated
WM-115	WM115	CVCL_0040	WM-115 cell	Homo Sapiens	Skin	Skin; Right anterior leg	55Y	Adult	Female	Caucasian	Melanoma	no available	cell	WM115-MEL; WM 115; WM115F; WM115 CELL; WC00079; WM115MEL; WM-115	curated
SJRH30	Rh30	CVCL_0041	Rh-30 cell	Homo Sapiens	Soft Tissue	Bone marrow	17Y	Juvenile	Male	Caucasian	Alveolar rhabdomyosarcoma	no available	cell	SJ-RH 30; SJCRH30; SJRH 30; RMS13; RH30SJ; RH30 CELL; RMS 13; RH-30; RC13; SJRH30; RMS-13; SJRH-30; RH30; SJ-RH30	curated
U-2-OS	U2OS	CVCL_0042	U2-OS cell	Homo Sapiens	Bone	Tibia	15Y	Juvenile	Female	Caucasian	Osteosarcoma	no available	cell	2T; U-2 OS; NAN; U-2-OS; U2OS CELL; U2-OS; U2 OSTEOSARCOMA CELL; U-2OS; U20-S; U20S	curated
BeWo	BeWo	CVCL_0044	BeWo cell	Homo Sapiens	Placenta	Fetal brain	no available	Fetus	Male	Caucasian	Gestational choriocarcinoma	no available	cell	BEWO CELL; BE WO; BE-WO; BEWO	curated
HEK293	HEK293	CVCL_0045	HEK-293 cell	Homo Sapiens	Kidney	Fetal kidney	no available	Fetus	Female	no available	no available	no available	cell	HEK293; HEK/293; GRAHAM-293; A293 CELL; HEK 293; 293 AD5; HUMAN EMBRYONAL KIDNEY CELL; HEK-293; A-293 CELL; HEK; 293 HEK; GRAHAM 293; HUMAN EMBRYONIC KIDNEY 293; 293; HEK CELL; HEK293 CELL; 293 CELL; HUMAN EMBRYONIC KIDNEY CELL	curated
HeLa S3	HeLa S3	CVCL_0058	HeLa-S3 cell	Homo Sapiens	no available	Cervix	30Y6M	no available	Female	African American	Human papillomavirus-related cervical adenocarcinoma	no available	cell	S3 CLONE; HELA/S3; S3 HELA; HELA.S3; HELA S3 CELL; HELA S 3; HELAS3; S3-HELA; HELA S-3; HELA-S3; HELA S3	curated
NCI-H1299	NCI-H1299	CVCL_0060	NCI-H1299 cell	Homo Sapiens	Lung	Lymph node	43Y	Adult	Male	Caucasian	Lung large cell carcinoma	no available	cell	NCIH1299; NAN; H-1299 CELL; H-1299; H1299; H1299 CELL	curated
MDA-MB-231	MDA-MB-231	CVCL_0062	MDA-MB-231 cell	Homo Sapiens	Breast	Pleural effusion	51Y	Adult	Female	Caucasian	Breast adenocarcinoma	no available	cell	MDA MB231; MDA.MB.231; MDA MB 231; MDA-231 CELL; MDAMB-231 CELL; MDA231; MDAMB-231; MDA_MB_231; MDA-MB231 CELL; HTB-26 CELL; MDA-231; MB231; MDA-MB 231; MDA-231P; MDA231-BRE; MDA-MB231; MDAMB231; HTB26 CELL; MD ANDERSON-METASTATIC BREAST-231	curated
MV-4-11	MV4-11	CVCL_0064	MV-4-11 cell	Homo Sapiens	Blood	Peripheral blood	10Y	Children	Male	Caucasian	Childhood acute megakaryoblastic leukemia	no available	cell	MV4; 11) CELL; MV(4; MV4-11 CELL; 11 CELL; MV-4:11; MV4II CELL; MV411; MV4:11; MV4II; 11); MV 4; 11; MV-4-11	curated
Jurkat	Jurkat	CVCL_0065	JURKAT cell	Homo Sapiens	Blood	Peripheral blood	14Y	Juvenile	Male	Caucasian	T-cell childhood acute lymphocytic leukemia	T cell	cell	FCCH1024; JURKAT; JURKAT-FHCRC; JURKAT CELL; FHCRC-11; JM; JM CELL; JURKAT FHCRC; JM-JURKAT; FHCRC SUBCLONE 11	curated
NAMALWA	Namalwa	CVCL_0067	NAMALWA cell	Homo Sapiens	Haematopoietic and Lymphoid	no available	3Y	Children	Female	African; Kenyan	Burkitt lymphoma	B cell	cell	NWA; NK62A; NAMALWA CELL; NAN; NAMALWA; NAMALWA IV; NAMALVA	curated
SK-MEL-1	SK-MEL-1	CVCL_0068	SK-MEL-1 cell	Homo Sapiens	Skin	Lymphatic system; Thoracic lymph duct	29Y	Adult	Male	Caucasian	Melanoma	no available	cell	SK 1; SK-MEL1; SK-MEL-1; SK-MEL 1; SKMEL-1; SK MEL 1; SKMEL1	curated
SK-MEL-2	SK-MEL-2	CVCL_0069	SK-MEL-2 cell	Homo Sapiens	Skin	Skin; Thigh	6Y	Children	Male	Caucasian	Melanoma	no available	cell	SKML2; SKMEL2; SK-ML2; SKMEL-2; SK-MEL 2; SK-MEL-2; SK-MEL2; SK.MEL.2; SK MEL 2	curated
SNU-16	SNU-16	CVCL_0076	SNU-16 cell	Homo Sapiens	Stomach	Ascites	33Y	Adult	Female	Korean	Gastric adenocarcinoma	no available	cell	SNU16; NCI-SNU-16	curated
SNU-398	SNU-398	CVCL_0077	SNU-398 cell	Homo Sapiens	Liver	Liver	42Y	Adult	Male	Korean	Adult hepatocellular carcinoma	no available	cell	NCI-SNU-398; SNU398 CELL; SNU398	curated
SNU-5	SNU-5	CVCL_0078	SNU-5 cell	Homo Sapiens	Stomach	Ascites	33Y	Adult	Female	Korean	Gastric adenocarcinoma	no available	cell	SNU5; NCI-SNU-5	curated
697	697	CVCL_0079	697 cell	Homo Sapiens	Bone Marrow	Bone marrow	12Y	Children	Male	Caucasian	B-cell childhood acute lymphoblastic leukemia	no available	cell	EMORY UNIVERSITY-3; LINE 697; EU-3	curated
A673	A-673	CVCL_0080	A-673 cell	Homo Sapiens	Bone	Muscle	15Y	Juvenile	Female	Caucasian	Ewing sarcoma	no available	cell	NAN; A673 CELL; A673; RMS1598; RMS 1598	curated
MHH-CALL-3	MHH-CALL-3	CVCL_0089	no available	Homo Sapiens	Bone Marrow	Bone marrow	11Y	Children	Female	Caucasian	B-cell acute lymphoblastic leukemia	no available	cell	MHH-CALL 3; MHHCALL3; MHH-CALL3; MHH CALL 3	curated
SNU-182	SNU-182	CVCL_0090	SNU-182 cell	Homo Sapiens	Liver	Liver	24Y	Adult	Male	Korean	Adult hepatocellular carcinoma	no available	cell	SNU354 CELL; NCI-SNU-182; SNU182	curated
NALM-1	NALM-1	CVCL_0091	no available	Homo Sapiens	Blood	Peripheral blood	3Y	Children	Female	African American	 bcr-abl1 positive; Chronic myelogenous leukemia	no available	cell	NALM-1; NALM 1; NALM1	curated
NALM-6	NALM-6	CVCL_0092	NALM-6 cell	Homo Sapiens	Blood	Peripheral blood	19Y	Adult	Male	Caucasian	B-cell adult acute lymphocytic leukemia	no available	cell	NALM-6 CELL; NALM6 CELL; NALM-6-M1; NALM6; NALM 6; NALM-6; NALM6/P CELL	curated
RS4-11	RS4;11	CVCL_0093	RS4-11 cell	Homo Sapiens	Bone Marrow	Bone marrow	32Y	Adult	Female	Caucasian	B-cell acute lymphoblastic leukemia	no available	cell	RS 4; RS411; RS4-11; RS(4; 11); RS4:11; 11; RS4 11 CELL	curated
SEM	SEM	CVCL_0095	no available	Homo Sapiens	Blood	Peripheral blood	5Y	Children	Female	Caucasian	B-cell acute lymphoblastic leukemia	no available	cell	SEM	curated
SKM-1	SKM-1	CVCL_0098	SKM-1 cell	Homo Sapiens	Blood	Peripheral blood	76Y	Elderly	Male	Japanese	Myelodysplastic syndrome	no available	cell	SKM1	curated
SNU-1	SNU-1	CVCL_0099	SNU-1 cell	Homo Sapiens	Stomach	Stomach	44Y	Adult	Male	Korean	Gastric adenocarcinoma	no available	cell	NCI-SNU-1; SNU1; SNU1 CELL	curated
SNU-601	SNU-601	CVCL_0101	no available	Homo Sapiens	Stomach	Ascites	34Y	Adult	Male	Korean	Gastric signet ring cell adenocarcinoma	no available	cell	SNU601; NCI-SNU-601	curated
SNU-638	SNU-638	CVCL_0102	SNU-638 cell	Homo Sapiens	Stomach	Ascites	48Y	Adult	Male	Korean	Gastric adenocarcinoma	no available	cell	SNU638 CELL; SNU638	curated
SUP-B15	SUP-B15	CVCL_0103	no available	Homo Sapiens	Bone Marrow	Bone marrow	8Y	Children	Male	Caucasian	B-cell childhood acute lymphoblastic leukemia	no available	cell	SUPB-15; SUP-B15; SUPB15; NAN; SUPB15WT; SUPB15W	curated
DU-145	DU145	CVCL_0105	DU-145 cell	Homo Sapiens	Prostate	Brain	69Y	Elderly	Male	Caucasian	Prostate carcinoma	no available	cell	DU-145; NAN; DU.145; DU 145; DU145 CELL; DUKE UNIVERSITY 145; DU_145	curated
BCP-1	BCP-1	CVCL_0107	BCP-1 cell	Homo Sapiens	Blood	Peripheral blood	92Y	Elderly	Male	Caucasian	Primary effusion b-cell non-hodgkin lymphoma	no available	cell	BCP1	curated
1321N1	1321N1	CVCL_0110	1321-N1 cell	Homo Sapiens	Brain	Brain	50Y	Adult	Male	Caucasian	Brain astrocytoma	no available	cell	1321-N1; 1321 N1 CELL; 1321N1 CELL; 1321 N1	curated
5637	5637	CVCL_0126	5637 cell	Homo Sapiens	Bladder	Urinary bladder	68Y	Elderly	Male	White	Bladder carcinoma	no available	cell	5637	curated
A172	A-172	CVCL_0131	A-172 cell	Homo Sapiens	Brain	Brain	53Y	Adult	Male	Caucasian	Glioblastoma	no available	cell	A172; A-172 MG; A-172MG; A 172; A172 CELL	curated
A375	A-375	CVCL_0132	A-375 cell	Homo Sapiens	Skin	Skin	54Y	Adult	Female	Caucasian	Amelanotic melanoma	no available	cell	A375-MEL; A375 CELL; A375MEL; A 375; A375	curated
A2780	A2780	CVCL_0134	A-2780 cell	Homo Sapiens	Ovary	Ovary	no available	no available	Female	African American	Ovarian endometrioid adenocarcinoma	no available	cell	A2780PAR; A2780S; NAN; A-2780; 2780	curated
AGS	AGS	CVCL_0139	AGS cell	Homo Sapiens	Stomach	Stomach	54Y	Adult	Female	Caucasian	Gastric adenocarcinoma	no available	cell	AGS	curated
AsPC-1	AsPC-1	CVCL_0152	AsPC-1 cell	Homo Sapiens	Pancreas	Ascites	62Y	Adult	Female	Caucasian	Pancreatic ductal adenocarcinoma	no available	cell	ASPC1 CELL; ASPC-1; NAN; AS-PC1 CELL; ASPC1; AS-PC1	curated
B-CPAP	B-CPAP	CVCL_0153	B-CPAP cell	Homo Sapiens	Thyroid	Thyroid gland	76Y	Elderly	Female	Caucasian	Poorly differentiated thyroid gland carcinomaa	no available	cell	BCPAP; BCPAP CELL; BC-PAP	curated
BE2-M17	SK-N-BE(2)-M17	CVCL_0167	BE(2)-M17 cell	Homo Sapiens	Peripheral Nervous System	Bone marrow	2Y	Infant	Male	Caucasian	Neuroblastoma	no available	cell	BE(2)M17 CELL; SK-N-BE(2)-M17; SK-N-BE(2)M17 CELL; BE(2)-M17; BE2-M17; BE(2)M-17; BE(2)M17; BE2M17; SK-N-BE(2)M-17 CELL	curated
BT-20	BT-20	CVCL_0178	BT-20 cell	Homo Sapiens	Breast	Mammary gland	74Y	Elderly	Female	Caucasian	Invasive breast carcinoma	no available	cell	BT 20; BT20 CELL; BT20	curated
BT-474	BT-474	CVCL_0179	BT-474 cell	Homo Sapiens	Breast	Breast	60Y	Adult	Female	Caucasian	Invasive breast carcinoma	no available	cell	BT474 CELL; BT-474; BT474	curated
BV-173	BV-173	CVCL_0181	BV173 cell	Homo Sapiens	Blood	Peripheral blood	45Y	Adult	Male	Caucasian	 bcr-abl1 positive; Chronic myelogenous leukemia	no available	cell	BV173	curated
BxPC-3	BxPC-3	CVCL_0186	BxPC-3 cell	Homo Sapiens	Pancreas	Pancreas	61Y	Adult	Female	Caucasian	Pancreatic ductal adenocarcinoma	no available	cell	BX-PC3; BXPC3; NAN; BXPC-3; BX-PC3 CELL; BXPC3 CELL; BIOPSY XENOGRAFT OF PANCREATIC CARCINOMA LINE-3	curated
Caov-3	Caov-3	CVCL_0201	CAOV-3 cell	Homo Sapiens	Ovary	Ovary	54Y	Adult	Female	Caucasian	High grade ovarian serous adenocarcinoma	no available	cell	CAOV3; CA-OV-3; CAOV3 (S); CAOV3 CELL; CAOV-3	curated
Caov-4	Caov-4	CVCL_0202	no available	Homo Sapiens	Ovary	Subserosa; Subserosa of fallopian tube; Fallopian tube	45Y	Adult	Female	Caucasian	High grade ovarian serous adenocarcinoma	no available	cell	CAOV-4; CAOV4	curated
CC-LP-1	CC-LP-1	CVCL_0205	CCLP-1 cell	Homo Sapiens	Biliary Tract	Liver	48Y	Adult	Female	Caucasian	Intrahepatic cholangiocarcinoma	no available	cell	CCLP1; CC-LP-I CELL; CCLP1 CELL; CC-LP-1 CELL; CCLP-1; CC-LP-I	curated
CCRF-CEM	CCRF-CEM	CVCL_0207	CCRF-CEM cell	Homo Sapiens	Blood	Peripheral blood	4Y	Children	Female	Caucasian	T-cell childhood acute lymphocytic leukemia	T cell	cell	CEM-0; GM03671C; CEM-CCRF (CAMR); CCRF CEM; CCRFCEM CELL; CEM; CCRF; CCRF/CEM; CEM/0; CCRF/CEM/0; CCRFCEM; CCRF.CEM CELL; NAN; CCRF CEM CELL; CEM CELL; GM03671; CCRF.CEM; CEM-CCRF; CCRF-CEM/S; CEM T-CELL; CCRF/CEM CELL	curated
CESS	CESS	CVCL_0209	CESS cell	Homo Sapiens	Blood	Peripheral blood	no available	Adult	Male	Caucasian	Acute myeloid leukemia	no available	cell	CESS	curated
CMK	CMK	CVCL_0216	CMK cell	Homo Sapiens	Blood	Peripheral blood	10M	no available	Male	Japanese	Myeloid leukemia associated with down syndrome	no available	cell	CMK	curated
CMK11-5	CMK-11-5	CVCL_0217	no available	Homo Sapiens	Blood	Peripheral blood	10M	no available	Male	Japanese	Myeloid leukemia associated with down syndrome	no available	cell	CMK115; CMK 11-5; CMK11-5	curated
COLO-205	COLO 205	CVCL_0218	Colo-205 cell	Homo Sapiens	Large Intestine	Ascites	70Y	Elderly	Male	Caucasian	Colon adenocarcinoma	no available	cell	COLO205 CELL; CO 205; COLO.205; COLO-205; COLO205; COLO 205 CELL; COLO 205; COLORADO 205	curated
CAKI-1	Caki-1	CVCL_0234	Caki-1 cell	Homo Sapiens	Kidney	Skin	49Y	Adult	Male	Caucasian	Clear cell renal cell carcinoma	no available	cell	CAKI-1; CAKI 1; CAKI1; CAKI.1; CAKI1 CELL	curated
CAKI-2	Caki-2	CVCL_0235	Caki-2 cell	Homo Sapiens	Kidney	Kidney	69Y	Elderly	Male	Caucasian	Kidney carcinoma; Papillary renal cell carcinoma	no available	cell	CAKI2; CAKI 2 CELL; CAKI 2; CAKI-2; CAKI2 CELL	curated
Calu-6	Calu-6	CVCL_0236	Calu-6 cell	Homo Sapiens	Lung	Pleural effusion	61Y	Adult	Female	Caucasian	Lung adenocarcinoma	no available	cell	CALU-6; CALU6; CALU 6; CALU6 CELL; CALU-06; CALU.6	curated
CAPAN-1	Capan-1	CVCL_0237	CAPAN-1 cell	Homo Sapiens	Pancreas	Liver	40Y	Adult	Male	Caucasian	Pancreatic ductal adenocarcinoma	no available	cell	CAPAN1; CAPAN-1 CELL; CAPAN-1; CAPAN 1	curated
DAN-G	DAN-G	CVCL_0243	no available	Homo Sapiens	Pancreas	Pancreas	68Y	Elderly	Female	Caucasian	Pancreatic adenocarcinom	no available	cell	DANG; DAN; DAN-G	curated
DG-75	DG-75	CVCL_0244	DG-75 cell	Homo Sapiens	Haematopoietic and Lymphoid	Pleural effusion	10Y	Children	Male	Jewish; Ashkenazi	Burkitt lymphoma	B cell	cell	DG75 CELL; DG 75; D.G.-75; DG75	curated
DLD-1	DLD-1	CVCL_0248	DLD-1 cell	Homo Sapiens	Colon	Colon	67Y	Elderly	Male	Caucasian	Colon adenocarcinoma	colon epithelial cell	cell	COCL3; DLD 1; DLD1	curated
SNU-387	SNU-387	CVCL_0250	SNU-387 cell	Homo Sapiens	Liver	Liver	41Y	Adult	Female	Korean	Adult hepatocellular carcinoma	no available	cell	SNU387; SNU387 CELL; NCI-SNU-387	curated
EFM-19	EFM-19	CVCL_0253	EFM-19 cell	Homo Sapiens	Breast	Pleural effusion	50Y	Adult	Female	Caucasian	Breast ductal carcinoma	no available	cell	EFM19 CELL; EFM19	curated
EoL-1-cell	EoL-1	CVCL_0258	EoL-1 cell	Homo Sapiens	Blood	Peripheral blood	33Y	Adult	Male	Caucasian	Acute myeloid leukemia	no available	cell	EOL-1; AML-EOL-1; EOL-1-CELL; EOL-1 CELL; EOL1	curated
G-401	G-401	CVCL_0270	G-401 cell	Homo Sapiens	Kidney	Kidney	3M	no available	Male	Caucasian	Rhabdoid tumor of the kidney	no available	cell	G 401 CELL; G 401; G401; G401 CELL	curated
Geo	GEO	CVCL_0271	GEO cell	Homo Sapiens	Colon	Colon	no available	no available	no available	no available	Colon carcinoma	no available	cell	HCT-GEO; HCT GEO; GEO	curated
HCC1937	HCC1937	CVCL_0290	HCC-1937 cell	Homo Sapiens	Breast	Mammary gland duct	23Y	Adult	Female	Caucasian	Breast ductal carcinoma	no available	cell	HCC/1937; HAMON CANCER CENTER 1937; HCC1937 CELL; HCC-1937	curated
HCT-116	HCT 116	CVCL_0291	HCT-116 cell	Homo Sapiens	Colon	Colon	48Y	Adult	Male	Caucasian	Colon carcinoma	no available	cell	HTC-116 CELL; HCT-166 CELL; HCT116WT; COCL2; NAN; HCT-116; HCT116 CELL; HCT_116; HTC 116 CELL; HCT.116; HCT116; HTC116 CELL; HCT 116 CELL	curated
HCT-15	HCT 15	CVCL_0292	HCT-15 cell	Homo Sapiens	Colon	Colon	67Y	Elderly	Male	Caucasian	Colon adenocarcinoma	colon epithelial cell	cell	HCT 15 CELL; HCT15; HCT.15; HCT-15; HCT15 CELL	curated
HEC-1-A	HEC-1-A	CVCL_0293	HEC-1-A cell	Homo Sapiens	Endometrium	Endometrium	71Y	Elderly	Female	Japanese	Endometrial adenocarcinoma	no available	cell	HEC-1-A; HEC1A; HEC-1A; HEC1-A; HEC1A CELL; HEC-1A CELL	curated
HEC-1-B	HEC-1-B	CVCL_0294	HEC-1-B cell	Homo Sapiens	Endometrium	Endometrium	71Y	Elderly	Female	Japanese	Endometrial adenocarcinoma	no available	cell	HEC-1-B; HEC-1B; HEC-1B CELL; HEC1-B; HEC1B CELL; HEC1B	curated
Hey	HEY	CVCL_0297	HEY cell	Homo Sapiens	Ovary	Ovary	no available	no available	Female	Caucasian	High grade ovarian serous adenocarcinoma	no available	cell	HEY	curated
HK-2	HK-2 [Human kidney]	CVCL_0302	HK-2 cell	Homo Sapiens	Kidney	Kidney	no available	Adult	Male	Caucasian	Non-cancerous	no available	cell	HUMAN KIDNEY-2; HK2; HK-2; HK2 CELL	curated
HOS	HOS	CVCL_0312	HOS cell	Homo Sapiens	Bone	Right femur	13Y	Juvenile	Female	Caucasian	Osteosarcoma	no available	cell	HOS	curated
HPAF-II	HPAF-II	CVCL_0313	HPAF-2 cell	Homo Sapiens	Pancreas	Ascites; Peritoneal ascitic fluid	44Y	Adult	Male	Caucasian	Pancreatic ductal adenocarcinoma	no available	cell	CD18/HPAF; HPAF-II/CD18; CD18; HPAF-II CELL; HPAF2 CELL; HPAF-2; HPAF/CD18; HPAFII CELL; HPAF II; HPAF2; CD 18; CD-18; HPAFII	curated
HSC-5	HSC-5 [Human skin squamous cell carcinoma]	CVCL_0314	no available	Homo Sapiens	Skin	Skin	75Y	Elderly	Male	Japanese	Skin squamous cell carcinoma	no available	cell	HSC5	curated
HT-1080	HT-1080	CVCL_0317	HT-1080 cell	Homo Sapiens	Soft Tissue	Bone; Acetabulum; Pelvis	35Y	Adult	Male	Caucasian	Fibrosarcoma	no available	cell	HT 1080; HT 1080 CELL; HT-1080; HT 1080.T; HT1080; HT1080 CELL	curated
HT-144	HT-144	CVCL_0318	HT-144 cell	Homo Sapiens	Skin	Hypodermis; Subcutaneous tissue	29Y	Adult	Male	Caucasian	Melanoma	no available	cell	HT144MEL; HT144; HT144-MEL; HT 144	curated
HT-29	HT-29	CVCL_0320	HT-29 cell	Homo Sapiens	Colon	Colon	44Y	Adult	Female	Caucasian	Colon adenocarcinoma	no available	cell	HT29 CELL; HT29; HT 29; HT29-CRC CELL	curated
HuCCT1	HuCC-T1	CVCL_0324	HuCCT-1 cell	Homo Sapiens	Biliary Tract	Ascites; Bile duct	56Y	Adult	Male	Japanese	Intrahepatic cholangiocarcinoma	no available	cell	HUCC-T1; HUCCT-1; HUCCT1 CELL; HUCCT1; HUCC-T1 CELL	curated
Hep3B2-1-7	Hep 3B2.1-7	CVCL_0326	HEP-3B cell	Homo Sapiens	Liver	Liver	8Y	Children	Male	African American	Pediatric hepatocellular carcinoma	no available	cell	HEP3B2 CELL; HEP 3B2; HEP3B; HEP 3B CELL; HEP-3B; HEP3B2; HEP 3B2 CELL; HEP 3B2_1-7; HEP 3B2.1-7 CELL; HEP-3B2 CELL; HEP-3B  CELL; HEP-3B2; HEP3B CELL; HEP3B217; HEP 3B	curated
Hs-294-T	Hs 294T	CVCL_0331	HS-294T cell	Homo Sapiens	Skin	Lymph node	56Y	Adult	Male	Caucasian	Melanoma	no available	cell	HS-294; HS294T; HS-294T; HS-294 CELL; HS-294-T; HS294; HS294T CELL; HS 294T CELL; HS294 CELL	curated
Hs-578-T	Hs 578T	CVCL_0332	Hs-578T cell	Homo Sapiens	Breast	Breast	74Y	Elderly	Female	Caucasian	Invasive breast carcinoma	no available	cell	"HS 578T; HS578; HS578 CELL; HOMO SAPIENS NO. 578, TUMOR CELLS; 578T; HS-578-T; HS-578T; HS_578T; HS0578T; HS578T; HS-578-T CELL; HS578T CELL; HS 578.T; HS 578T CELL"	curated
Hs-746T	Hs 746.T	CVCL_0333	no available	Homo Sapiens	Stomach	Skeletal muscle; Left leg	74Y	Elderly	Male	Caucasian	Gastric adenocarcinoma	no available	cell	HS746T; 746T; HS746-T; HS 746T; HS-746T	curated
Hs-766T	Hs 766T	CVCL_0334	HS-766T cell	Homo Sapiens	Pancreas	Lymph node	46Y	Adult	Male	Caucasian	Pancreatic adenocarcinoma	no available	cell	HS-766T; HS766T; HS 766; H766T; HS 766.T; 766T; HS-766-T; HS 766T; HS766T CELL; HS 766T CELL	curated
HuH-7	Huh-7	CVCL_0336	HuH-7 cell	Homo Sapiens	Liver	Liver	57Y	Adult	Male	Japanese	Adult hepatocellular carcinoma	no available	cell	JTC-39; HUH7; HUH7.0; HUH-7; HUH7 CELL; JAPANESE TISSUE CULTURE-39; HUH-7 CELL	curated
HuT-78	HuT 78	CVCL_0337	HUT-78 cell	Homo Sapiens	Blood	Peripheral blood	53Y	Adult	Male	Caucasian	Sezary syndrome	T cell	cell	NCI-H78; HUT 78; HUT-78; HUT78 CELL; HUT78; HUT 78 CELL	curated
IMR-32	IMR-32	CVCL_0346	IMR-32 cell	Homo Sapiens	Peripheral Nervous System	Abdominal mass; Abdomen	1Y	Infant	Male	Caucasian	Neuroblastoma	no available	cell	GM3320C; AG3320 CELL; IMR 32 CELL; AG3320; IMR32 CELL; NAN; GM3320C CELL; INSTITUTE FOR MEDICAL RESEARCH-32; AG03320 CELL; INSTITUTE FOR MEDICAL RESEARCH-32 CELL; GM03320 CELL; GM3320D CELL; IMR32; AG03320; GM03320D; GM03320; IMR 32	curated
