cell line	cellosaurus name	cellosaurus accession	bto cell line	organism	organism part	sampling site	age	developmental stage	sex	ancestry category	disease	cell type	Material type	synonyms	curated
OVKATE	OVKATE	CVCL_3110	OVKATE cell	Homo Sapiens	Ovary	Ovary	40Y	Adult	Female	Japanese	High grade ovarian serous adenocarcinoma	no available	cell	OVKATE	curated
OVMANA	OVMANA	CVCL_3111	OVMANA cell	Homo Sapiens	Ovary	Ovary	51Y	Adult	Female	Japanese	Ovarian clear cell adenocarcinoma	no available	cell	OVMANA	curated
OVMIU	OVMIU	CVCL_3112	no available	Homo Sapiens	Ovary	Ovary	64Y	Adult	Female	Japanese	High grade ovarian serous adenocarcinoma	no available	cell	OVMIU	curated
OVSAHO	OVSAHO	CVCL_3114	OVSAHO cell	Homo Sapiens	Ovary	Abdomen	56Y	Adult	Female	Japanese	High grade ovarian serous adenocarcinoma	no available	cell	NAN; NO AVAILABLE	curated
OVSAYO	OVSAYO	CVCL_3115	OVSAYO cell	Homo Sapiens	Ovary	Ovary	64Y	Adult	Female	Japanese	High grade ovarian serous adenocarcinoma	no available	cell	OVSAYO	curated
OVISE	OVISE	CVCL_3116	OVISE cell	Homo Sapiens	Ovary	Innominate bone; Pelvis	40Y	Adult	Female	Japanese	Ovarian clear cell adenocarcinoma	no available	cell	OVISE	curated
OVTOKO	OVTOKO	CVCL_3117	OVTOKO cell	Homo Sapiens	Ovary	Spleen	78Y	Elderly	Female	Japanese	Ovarian clear cell adenocarcinoma	no available	cell	OVTOKO	curated
P32-ISH	P32/ISH	CVCL_3119	no available	Homo Sapiens	Blood	Peripheral blood	8Y	Children	Male	Japanese	Burkitt lymphoma	B cell	cell	P32-ISH; ISHIDA; P32 ISH; P32ISH; P32/ISH; P32/ISHIDA; P32	curated
QGP-1	QGP-1	CVCL_3143	QGP-1 cell	Homo Sapiens	Pancreas	Islets of langerhans; Pancreas	61Y	Adult	Male	Japanese	Pancreatic somatostatinoma	pancreatic D cell	cell	QGP1 CELL; QGP1; QGP 1	curated
RERF-GC-1B	RERF-GC-1B	CVCL_3152	no available	Homo Sapiens	Stomach	Pyloric lymph node; Pyloric lymph nodes	41Y	Adult	Male	Japanese	Gastric adenocarcinoma	no available	cell	RADIATION EFFECTS RESEARCH FOUNDATION-GASTRIC CANCER-1B; RERFGC1B	curated
RERF-LC-MA	RERF-LC-MA	CVCL_3153	no available	Homo Sapiens	Lung	Pleural effusion	65Y	Elderly	Male	Caucasian	Squamous cell lung carcinoma	no available	cell	LC-MA; MATSUSHIMA; LCMA; RERF-LCMA; RADIATION EFFECTS RESEARCH FOUNDATION-LUNG CANCER-MA	curated
RERF-LC-OK	RERF-LC-OK	CVCL_3154	no available	Homo Sapiens	Brain	no available	59Y	Adult	Female	Caucasian	Brain astrocytoma	no available	cell	LCOK; RERF-LCOK; RADIATION EFFECTS RESEARCH FOUNDATION-LUNG CANCER-OK; RERFLCOK; LC-OK	curated
RKN	RKN	CVCL_3156	no available	Homo Sapiens	Soft Tissue	Ovary	45Y	Adult	Female	Japanese	Ovarian leiomyosarcoma	no available	cell	RKN	curated
RMUG-S	RMUG-S	CVCL_3158	no available	Homo Sapiens	Ovary	Ovary	62Y	Adult	Female	Japanese	Ovarian mucinous cystadenocarcinoma	no available	cell	RMUGS	curated
SAT	SAT [Human HNSCC]	CVCL_3160	no available	Homo Sapiens	Mouth	Mouth	no available	no available	no available	Japanese	Head and neck squamous cell carcinoma	no available	cell	SAT	curated
SCCH-196	SCCH-196	CVCL_3161	no available	Homo Sapiens	Soft Tissue	no available	16Y	Juvenile	Female	Japanese	Ewing sarcoma	no available	cell	SCCH196	curated
SEKI	SEKI	CVCL_3162	no available	Homo Sapiens	Skin	Skin; Leg; Skin (lower leg)	28Y	Adult	Female	Japanese	Melanoma	no available	cell	SEKI	curated
SKN	SKN	CVCL_3167	no available	Homo Sapiens	Uterus	Uterus	52Y	Adult	Female	Japanese	Uterine corpus leiomyosarcoma	no available	cell	SKN	curated
SKN-3	SKN-3	CVCL_3168	no available	Homo Sapiens	Head and Neck	no available	no available	no available	no available	Japanese	Oral cavity squamous cell carcinoma	no available	cell	SKN3	curated
SLVL	VL51	CVCL_3169	no available	Homo Sapiens	Blood	Peripheral blood	70Y	Elderly	Female	Japanese	Splenic marginal zone lymphoma	no available	cell	VL-51; VL51; SLVL	curated
SUIT-2	SUIT-2	CVCL_3172	SUIT-2 cell	Homo Sapiens	Pancreas	Liver	73Y	Elderly	Male	Japanese	Pancreatic ductal adenocarcinoma	no available	cell	SUIZO TUMOR-2; SUIT2; SUIT 2; SUIT-2 CELL; SUIT-2	curated
T-T	T.T	CVCL_3174	no available	Homo Sapiens	Esophagus	Mandible; Oesophagus	67Y	Elderly	Male	Japanese	Esophageal squamous cell carcinoma	no available	cell	T. T; TDOTT; T-T; TT; T_T_	curated
TASK1	TASK1	CVCL_3177	no available	Homo Sapiens	Chest	Chest wall	21Y	Adult	no available	Japanese	Askin tumor	no available	cell	TASK1	curated
TCC-PAN2	TCC-Pan2	CVCL_3178	no available	Homo Sapiens	Pancreas	Ascites	68Y	Elderly	Female	Japanese	Pancreatic ductal adenocarcinoma	no available	cell	TCC-PAN2; TCCPAN2	curated
TIG-3S	TIG-3S	CVCL_3210	no available	Homo Sapiens	Skin	Fetal skin; Skin	12FW	no available	Male	Japanese	Non-cancerous	skin fibroblast	cell	TOKYO INSTITUTE OF GERONTOLOGY-3 SKIN	curated
TMH-1	TMH-1	CVCL_3219	no available	Homo Sapiens	Thyroid	Left cervical lymph node	79Y	Elderly	Male	Japanese	Thyroid gland follicular carcinoma	no available	cell	TMH-1	curated
UE6E7T-3	UE6E7T-3	CVCL_3237	no available	Homo Sapiens	Bone	Bone marrow	91Y	Elderly	Female	Japanese	Non-cancerous	mesenchymal stem cell of the bone marrow	cell	TH-3; THMSC3; UEET-3	curated
HCC1937-BL	HCC1937 BL	CVCL_3281	no available	Homo Sapiens	Blood	Peripheral blood	23Y	Adult	Female	Caucasian	Non-cancerous	B cell	cell	HCC-1937BL; HCC1937-BL; HCC1937BL; HAMON CANCER CENTER 1937 BL	curated
Farage	Farage	CVCL_3302	no available	Homo Sapiens	Haematopoietic and Lymphoid	Lymph node	70Y	Elderly	Female	Caucasian	Diffuse large b-cell lymphoma germinal center b-cell type	no available	cell	FARAGE; FARAGE ORIGINAL LINE; FARAGE OL	curated
HMCB	HMCB	CVCL_3317	HMCB cell	Homo Sapiens	Skin	no available	no available	no available	Female	Caucasian	Melanoma	no available	cell	HUMAN MELANOMA CELL BOWES; HCMB; HUMAN BOWES MELANOMA CELL LINE; BOWES; BOWES MELANOMA CELLS	curated
HX	HX	CVCL_3318	no available	Homo Sapiens	Soft Tissue	Bone; Acetabulum; Pelvis	35Y	Adult	Male	Caucasian	Fibrosarcoma	no available	cell	HT1080 XENO	curated
Pfeiffer	Pfeiffer	CVCL_3326	Pfeiffer cell	Homo Sapiens	Haematopoietic and Lymphoid	Pleural effusion	no available	Adult	Male	Caucasian	Diffuse large b-cell lymphoma germinal center b-cell type	B cell	cell	PFEIFFER LYMPHOMA CELL; PFEIFFER	curated
TE-14	TE-14	CVCL_3336	no available	Homo Sapiens	Esophagus	Esophagus	57Y	Adult	Male	Japanese	Esophageal squamous cell carcinoma	no available	cell	TE14	curated
TE-4	TE-4	CVCL_3337	no available	Homo Sapiens	Esophagus	Lymph node; Esophagus	48Y	Adult	Female	Japanese	Esophageal squamous cell carcinoma	no available	cell	TE4	curated
TGBC18TKB	TGBC18TKB	CVCL_3338	no available	Homo Sapiens	Small Intestine	Ampulla of vater; Pancreas; Duodenum	79Y	Elderly	Female	Japanese	Ampulla of vater adenocarcinoma	no available	cell	UCFU; TGBC-18TKB; TGBC-18-TKB	curated
TGBC2TKB	TGBC2TKB	CVCL_3339	no available	Homo Sapiens	Biliary Tract	Lymph node; Gall bladder	no available	no available	Female	Japanese	Gallbladder undifferentiated carcinoma	no available	cell	TGBC-2; TGBC2; TGBC-2TKB; TGBC-2-TKB	curated
BGC-823	BGC-823	CVCL_3360	BGC-823 cell	Homo Sapiens	Cervix	Uterus	31Y	Adult	Female	African American	Human papillomavirus-related cervical adenocarcinoma	no available	cell	BGC823; BGC823 CELL	curated
GLC-82	GLC-82	CVCL_3371	GLC-82 cell	Homo Sapiens	Cervix	Uterus	31Y	Adult	Female	African American	Human papillomavirus-related cervical adenocarcinoma	no available	cell	GLC82; GLC-82 CELL; GLC82 CELL; GEJIU LUNG CARCINOMA-82 CELL; GLC-82; GEJIU LUNG CARCINOMA-82	curated
KE-39	KE-39	CVCL_3385	no available	Homo Sapiens	Stomach	Lymph node	77Y	Elderly	Male	Japanese	Gastric adenocarcinoma	no available	cell	KE39	curated
KE-97	KE-97	CVCL_3386	no available	Homo Sapiens	Haematopoietic and Lymphoid	Mesenterium	52Y	Adult	Male	Japanese	Plasma cell myeloma	no available	cell	KE97	curated
NTERA-2-cl-D1	NT2-D1	CVCL_3407	NT2/D1 cell	Homo Sapiens	Testis	Lung	22Y	Adult	Male	Caucasian	Embryonal carcinoma	no available	cell	NT2/D1; NTERA2D1; NT2D1; NTERA-2 CLONE D1; TERA; NTERA-2CL.D1; NTERA-2 CL.D1; NTERA-2D1; NTERA-2/D1; NTERA2 CL.D1; NTERA2CLD1; NTERA2-D1; NTERA-2 CL.D1 CELL; NTERA2/D1; NTERA2-CLONED1; NTERA 2/CL.D1; NT2-D1	curated
SUM-102PT	SUM102PT	CVCL_3421	SUM-102PT cell	Homo Sapiens	Breast	Breast	56Y	Adult	Female	no available	Breast carcinoma	no available	cell	SUM-102 CELL; SUM-102; 102PT; SUM102 CELL; SUM 102 CELL; SUM-102PT; SUM 102PT CELL; SUM 102PT; SUM102PT CELL; SUM102; SUM 102	curated
SUM-149PT	SUM149PT	CVCL_3422	SUM-149PT cell	Homo Sapiens	Breast	Breast	40Y	Adult	no available	no available	Inflammatory breast carcinoma	no available	cell	149PT; SUM-149; SUM149 CELL; SUM 149PT CELL; SUM-149PT; SUM 149; SUM 149 CELL; BRCL12; SUM 149PT; SUM-149 CELL; 149 PT; SUM149-PT; SUM149PT CELL; SUM149	curated
SUM-44PE	SUM44PE	CVCL_3424	SUM-44PE cell	Homo Sapiens	Breast	Pleural effusion	no available	no available	no available	no available	Invasive lobular breast carcinoma	no available	cell	SUM 44; SUM-44; SUM44 CELL; SUM44PE CELL; SUM-44 CELL; SUM 44PE; SUM44PE; SUM44; SUM-44PE; SUM-44 PE; 44PE; SUM 44PE CELL	curated
SUM-52PE	SUM52PE	CVCL_3425	SUM-52PE cell	Homo Sapiens	Breast	Pleural effusion	no available	no available	no available	no available	Breast carcinoma	no available	cell	SUM52; SUM-52-PE; SUM52 CELL; SUM 52 CELL; SUM 52PE CELL; SUM 52PE; SUM 52; SUM-52PE; SUM52PE CELL; 52PE; SUM-52 CELL; SUM-52	curated
EW-2	EW-2	CVCL_3446	no available	Homo Sapiens	Bone	Peripheral blood	19Y	Adult	Male	Caucasian	Ewing sarcoma	no available	cell	IARC-EW2; EW2; IARC-EW 2; IARC-EW-2	curated
CEMC1	CEM/C1	CVCL_3496	CEM-C1 cell	Homo Sapiens	Blood	Peripheral blood	4Y	Children	Female	Caucasian	T-cell childhood acute lymphocytic leukemia	T cell	cell	CEMC1 CELL; CCRF-CEM C1 CELL; CEM.C1; CCRF-CEM C1; CEM/C1 CELL; CEM-C1; CEMC1	curated
CEMC2	CEM/C2	CVCL_3497	CEM-C2 cell	Homo Sapiens	Blood	Peripheral blood	4Y	Children	Female	Caucasian	T-cell childhood acute lymphocytic leukemia	T cell	cell	CEMC2; CCRF-CEM C2 CELL; CCRF-CEM C2; CEM/C2 CELL; CEMC2 CELL; CEM-C2	curated
ES-2	ES-2	CVCL_3509	ES-2 cell	Homo Sapiens	Ovary	Ovary	47Y	Adult	Female	Caucasian	Ovarian clear cell adenocarcinoma	no available	cell	ES2; ES2 CELL	curated
HPAC	HPAC	CVCL_3517	HPAC cell	Homo Sapiens	Pancreas	Pancreas	64Y	Adult	Female	Caucasian	Pancreatic adenocarcinoma	pancreatic ductal cell	cell	HPAC	curated
HuT-102	HuT 102	CVCL_3526	no available	Homo Sapiens	Blood	Lymph node; Peripheral blood	28Y	Adult	no available	African American	T-cell non-hodgkin lymphoma	T cell	cell	NCI-H102; HUT 102; HUT-102; HUT102	curated
JM1	JM-1	CVCL_3532	no available	Homo Sapiens	Blood	Peripheral blood	no available	no available	Male	Caucasian	B-cell acute lymphoblastic leukemia	no available	cell	JM1	curated
LNZTA3WT4	LNZTA3WT4	CVCL_3540	no available	Homo Sapiens	Brain	no available	60Y	Adult	Male	Caucasian	Brain astrocytoma	no available	cell	LNZTA3P53WT4; WT4	curated
PL45	PL45	CVCL_3567	no available	Homo Sapiens	Pancreas	Pancreas	81Y	Elderly	Male	Caucasian	Pancreatic ductal adenocarcinoma	no available	cell	PL 45; PL-45	curated
RF-1	RF-1	CVCL_3580	no available	Homo Sapiens	Haematopoietic and Lymphoid	no available	62Y	Adult	Male	no available	B-cell non-hodgkin lymphoma	no available	cell	RF1	curated
SCaBER	SCaBER	CVCL_3599	SCaBER cell	Homo Sapiens	Bladder	Urinary bladder	58Y	Adult	Male	African American	Ureter transitional cell carcinoma	no available	cell	SCABER	curated
SW579	SW579	CVCL_3603	no available	Homo Sapiens	Thyroid	Thyroid gland	59Y	Adult	Male	Caucasian	Thyroid gland squamous cell carcinoma	no available	cell	SW-579; SW 579	curated
T1-73	T1-73	CVCL_3605	no available	Homo Sapiens	Bone	Bone	no available	no available	no available	Caucasian	Osteosarcoma	fibroblast	cell	T173; TI-73	curated
Toledo	Toledo	CVCL_3611	no available	Homo Sapiens	Blood	Peripheral blood	no available	Adult	Female	Caucasian	Diffuse large b-cell lymphoma germinal center b-cell type	B cell	cell	NAN; TOLEDO	curated
TOV-112D	TOV-112D	CVCL_3612	TOV-112D cell	Homo Sapiens	Ovary	Ovary	42Y	Adult	Female	Caucasian	Ovarian endometrioid adenocarcinoma	no available	cell	TOV-112D; TOV112D; TOV-112; TOV112	curated
TOV-21G	TOV-21G	CVCL_3613	TOV-21G cell	Homo Sapiens	Ovary	Ovary	62Y	Adult	Female	Caucasian	Ovarian clear cell adenocarcinoma	no available	cell	TOV-21G; TOV21; TOV21G	curated
YSCCC	YSCCC	CVCL_3629	no available	Homo Sapiens	Biliary Tract	Ascites	70Y	Elderly	Female	Japanese	Cholangiocarcinoma	no available	cell	CCC	curated
BJ	BJ [Human fibroblast]	CVCL_3653	BJ cell	Homo Sapiens	Skin	Skin; Foreskin	<1M	Neonate	Male	Caucasian	Non-cancerous	foreskin fibroblast	cell	BJ1; CRL-2522 CELL; FF-WT-BJ	curated
HP	HP	CVCL_3715	no available	Homo Sapiens	Soft Tissue	Bone; Acetabulum; Pelvis	35Y	Adult	Male	Caucasian	Fibrosarcoma	no available	cell	HT1080 POLY	curated
I-2-1	I 2.1	CVCL_3724	no available	Homo Sapiens	Blood	Peripheral blood	14Y	Juvenile	Male	Caucasian	T-cell childhood acute lymphocytic leukemia	T cell	cell	I-2-1; I2-1; I2.1	curated
I-9-2	I 9.2	CVCL_3725	I 9.2 cell	Homo Sapiens	Blood	Peripheral blood	14Y	Juvenile	Male	Caucasian	T-cell childhood acute lymphocytic leukemia	T cell	cell	I 9.2 T CELL; I9.2; I-9-2; I9-2	curated
JSC-1	JSC-1	CVCL_3728	no available	Homo Sapiens	Ascites	Ascites	52Y	Adult	Male	Caucasian	Primary effusion b-cell non-hodgkin lymphoma	no available	cell	JSC1; JSC	curated
NK-92MI	NK-92MI	CVCL_3755	no available	Homo Sapiens	Blood	Peripheral blood	50Y	Adult	Male	Caucasian	Natural killer cell lymphoblastic leukemia/lymphoma	natural killer cell	cell	NK92-MI; NK-92 MI; NK-92 TRANSFECTED WITH MFG-HIL2; NK92MI	curated
OV-90	OV-90	CVCL_3768	OV-90 cell	Homo Sapiens	Ovary	Ascites	64Y	Adult	Female	Caucasian	Ovarian adenocarcinoma	no available	cell	OV90 CELL; OV90	curated
PWR-1E	PWR-1E	CVCL_3775	PWR-1E cell	Homo Sapiens	Prostate	Epithelium; Prostate	67Y	Elderly	Male	Caucasian	Non-cancerous	epithelial cell of prostate	cell	PWR1E	curated
RKO-E6	RKO-E6	CVCL_3787	RKO-E6 cell	Homo Sapiens	Colon	Colon	no available	no available	no available	no available	Colon carcinoma	no available	cell	RKOE6	curated
RWPE-1	RWPE-1	CVCL_3791	RWPE-1 cell	Homo Sapiens	Prostate	Epithelium; Prostate	54Y	Adult	Male	Caucasian	Non-cancerous	epithelial cell of prostate	cell	RWPE1; RWPE1 CELL	curated
RWPE-2	RWPE-2	CVCL_3792	RWPE-2 cell	Homo Sapiens	Prostate	Epithelium; Prostate	54Y	Adult	Male	Caucasian	Non-cancerous	epithelial cell of prostate	cell	RWPE2	curated
RWPE2-W99	RWPE2-W99	CVCL_3793	no available	Homo Sapiens	Prostate	Epithelium; Prostate	54Y	Adult	Male	Caucasian	Non-cancerous	epithelial cell of prostate	cell	RWPE2-W99	curated
TO-175-T	TO 175.T	CVCL_3806	no available	Homo Sapiens	Haematopoietic and Lymphoid	Skin; Trunk	29Y	Adult	Male	Caucasian	Hodgkin's lymphoma	skin fibroblast	cell	TO-175-T; TO175T	curated
WIL2-S	WIL2 S	CVCL_3809	WIL2-S cell	Homo Sapiens	Haematopoietic and Lymphoid	Spleen	5Y	Children	Male	Caucasian	Hereditary spherocytosis	no available	cell	WIL2 SECRETING; WIL2/S; WIL2S; WIL2-S	curated
WPE1-NA22	WPE1-NA22	CVCL_3810	no available	Homo Sapiens	Prostate	Epithelium; Prostate	54Y	Adult	Male	Caucasian	Non-cancerous	epithelial cell of prostate	cell	WPE1NA22	curated
Li-7	Li-7	CVCL_3840	no available	Homo Sapiens	Liver	Liver	45Y	Adult	Male	Japanese	Adult hepatocellular carcinoma	no available	cell	LI7; C-LI-7	curated
HHUA	HHUA	CVCL_3866	no available	Homo Sapiens	Endometrium	Endometrium	54Y	Adult	Female	Japanese	Endometrial adenocarcinoma	no available	cell	HHUA-1	curated
HOUA-I	HOUA-I	CVCL_3867	no available	Homo Sapiens	Endometrium	Endometrium	55Y	Adult	Female	Japanese	Endometrial carcinoma	no available	cell	HOUA-1; HOUA; HOUAI	curated
SU8686	SU.86.86	CVCL_3881	SU.86.86 cell	Homo Sapiens	Pancreas	Liver	57Y	Adult	Female	Caucasian	Pancreatic adenocarcinoma	no available	cell	SU 86.86; SU-86-86; SU.86; SU.86.86; SU 86.86 CELL; SU8686; SU86.86 CELL; SU86_86; SU86.86; SU86-86	curated
EA-hy926	EA.hy 926	CVCL_3901	EAhy 926 cell	Homo Sapiens	Lung	no available	58Y	Adult	Male	White	Non-small cell lung carcinoma	no available	cell	EA.HY926; EA HY 926; EAHY-926; EAHY 926; EA-HY926; EAHY926; EAHY926 CELL; EA. HY 926; EA.HY 926 CELL; EA.HY926 CELL	curated
OVCA420	OVCA420	CVCL_3935	OVCA-420 cell	Homo Sapiens	Ovary	Ovary	no available	no available	Female	African American	Ovarian serous adenocarcinoma	no available	cell	OVCA-420; OVCAR420; OVCA420 CELL; NAN; OVCAR 420; OVCAR420 CELL; OVCAR-420 CELL; OVCA 420 CELL; OVCA 420; OVCAR-420	curated
SNU-216	SNU-216	CVCL_3946	SNU-216 cell	Homo Sapiens	Stomach	Lymph node	46Y	Adult	Female	Korean	Gastric tubular adenocarcinoma	no available	cell	NCI-SNU-216; SNU216	curated
LN-215	LN-215	CVCL_3954	LN-215 cell	Homo Sapiens	Brain	Temporo-occipito-parietal mass	60Y	Adult	Female	no available	Brain astrocytoma	no available	cell	LN215 CELL; LN 215; LN215	curated
LN-340	LN-340	CVCL_3955	LN-340 cell	Homo Sapiens	Brain	Right parietal lobe	57Y	Adult	Male	Caucasian	Glioblastoma	no available	cell	LN340 CELL; LN340; LN 340	curated
LN-382	LN-382	CVCL_3956	LN-382 cell	Homo Sapiens	Brain	no available	67Y	Elderly	no available	Caucasian	Glioblastoma	no available	cell	LN 382; LN382; LN382 CELL	curated
LN-235	LN-235	CVCL_3957	LN-235 cell	Homo Sapiens	Brain	no available	38Y	Adult	Male	Caucasian	Brain astrocytoma	no available	cell	LN235 CELL; LN 235; LN235	curated
LN-319	LN-319	CVCL_3958	LN-319 cell	Homo Sapiens	Brain	Right temporal lobe	67Y	Elderly	Male	Caucasian	Brain astrocytoma	no available	cell	LN 319; LN319; LN319 CELL	curated
LN-428	LN-428	CVCL_3959	LN-428 cell	Homo Sapiens	Brain	Left temporal lobe	48Y	Adult	Male	no available	Glioblastoma	no available	cell	LN428; LN428 CELL; LN 428	curated
LN-443	LN-443	CVCL_3960	LN-443 cell	Homo Sapiens	Brain	Left parietal lobe	48Y	Adult	no available	Caucasian	Glioblastoma	no available	cell	LN443 CELL; LN 443; LN443	curated
LN-444	LN-444	CVCL_3961	LN-444 cell	Homo Sapiens	Brain	Left parietal lobe	48Y	Adult	no available	Caucasian	Glioblastoma	no available	cell	LN444; LN 444; LN444 CELL	curated
LN-464	LN-464	CVCL_3962	LN-464 cell	Homo Sapiens	Brain	no available	no available	no available	no available	Caucasian	Glioblastoma; Melanoma	no available	cell	LN 464; LN464; LN464 CELL	curated
NCI-H125	NCI-H125	CVCL_3968	NCI-H125 cell	Homo Sapiens	Lung	Hypodermis	61Y	Adult	Male	African American	Lung adenosquamous carcinoma	no available	cell	NCI-HUT 125; HUT 125; HUT125 CELL; NCI-HUT-125 CELL; H125; H-125; HUT-125 CELL; H125 CELL; NCI-HUT 125 CELL; HUT-125; HUT125; NCI-HUT-125; H-125 CELL	curated
KKU-100	KKU-100	CVCL_3996	KKU-100 cell	Homo Sapiens	Biliary Tract	Liver	65Y	Elderly	Female	Southeast Asian; Thai	Opisthorchis viverrini-related cholangiocarcinoma; Biliary tract carcinoma	no available	cell	K100; KKU100	curated
T3M-4	T3M-4	CVCL_4056	T3M4 cell	Homo Sapiens	Pancreas	Lymph node	64Y	Adult	Male	Japanese	Pancreatic ductal adenocarcinoma	no available	cell	PANC 89; T3M4; PANC89; PANC-89	curated
HuH-6	HuH-6	CVCL_4381	HuH-6 cell	Homo Sapiens	Liver	Liver	1Y	Infant	Male	Japanese	Hepatoblastoma	no available	cell	HUH6 CELL; HUH-6; HUH 6; HUH6	curated
TMK-1	TMK-1	CVCL_4384	TMK-1 cell	Homo Sapiens	Stomach	Lymph node	21Y	Adult	Male	Japanese	Gastric adenocarcinoma	no available	cell	TMK1; TMK1 CELL	curated
hTERT-RPE-1	hTERT-RPE1	CVCL_4388	hTERT-RPE1 cell	Homo Sapiens	Eye	Retinal pigment epithelium; Retina	1Y	Infant	Female	no available	Non-cancerous	retinal pigment epithelial cell	cell	HTERT RPE1; HTERT-RPE; HTERT RPE-1; RPE1; RPE-HTERT; HTERT-RPE-1; RPE-1; HTERT-RPE-1 CELL; RPE-1 CELL; RPE1 CELL; TERT-RPE1; RPE1-HTERT	curated
RERF-LC-AI	RERF-LC-A1	CVCL_4402	RERF-LC-AI cell	Homo Sapiens	Lung	Pleural effusion	no available	no available	Male	Japanese	Squamous cell lung carcinoma	no available	cell	RERF-LC-A1 CELL; RADIATION EFFECTS RESEARCH FOUNDATION-LUNG CANCER-AI; AOI; RERF-LCAI; RERF-LC-AI; RERFLCAI; LC-AI CELL; RERF-LC-A1	curated
MCC14-1	MCC14/1	CVCL_4447	no available	Homo Sapiens	Skin	Iliac lymph node; Iliac node (groin)	80Y	Elderly	Male	no available	Merkel cell carcinoma	no available	cell	MCC14-1; MCC14/1TC; MCC14/1 TC	curated
TE-2	TE-2	CVCL_4455	TE-2 cell	Homo Sapiens	Esophagus	no available	no available	no available	Male	Japanese	Esophageal squamous cell carcinoma	no available	cell	TE2; TE2 CELL	curated
TE-13	TE-13	CVCL_4463	TE-13 cell	Homo Sapiens	Esophagus	no available	no available	no available	Male	Japanese	Esophageal squamous cell carcinoma	no available	cell	TE13 CELL; TE13	curated
BDCM	BDCM	CVCL_4613	no available	Homo Sapiens	Blood	Peripheral blood	no available	no available	Male	Caucasian	B-cell acute lymphoblastic leukemia	B cell	cell	B-CELL WITH DC MORPHOLOGY	curated
JHOC-5	JHOC-5	CVCL_4640	no available	Homo Sapiens	Ovary	Ovary	47Y	Adult	Female	Japanese	Ovarian clear cell adenocarcinoma	no available	cell	JHOC5	curated
JHOM-1	JHOM-1	CVCL_4644	no available	Homo Sapiens	Ovary	Ovary	88Y	Elderly	Female	Japanese	Ovarian mucinous adenocarcinoma	no available	cell	JHOM1	curated
JHOM-2B	JHOM-2B	CVCL_4645	no available	Homo Sapiens	Ovary	Ovary	56Y	Adult	Female	Japanese	Ovarian mucinous adenocarcinoma	no available	cell	JHOM2B	curated
JHOS-2	JHOS-2	CVCL_4647	no available	Homo Sapiens	Ovary	Lymph node	45Y	Adult	Female	Japanese	High grade ovarian serous adenocarcinoma	no available	cell	JHOS2	curated
JHOS-3	JHOS-3	CVCL_4648	no available	Homo Sapiens	Ovary	Lymph node	48Y	Adult	Female	Japanese	Ovarian serous adenocarcinoma	no available	cell	JHOS3	curated
JHOS-4	JHOS-4	CVCL_4649	no available	Homo Sapiens	Ovary	Peritoneum	44Y	Adult	Female	Japanese	High grade ovarian serous adenocarcinoma	no available	cell	JHOS4	curated
JHUEM-1	JHUEM-1	CVCL_4655	no available	Homo Sapiens	Endometrium	Endometrium	56Y	Adult	Female	Japanese	Endometrial adenocarcinoma	no available	cell	JHUEM1	curated
JHUEM-2	JHUEM-2	CVCL_4656	no available	Homo Sapiens	Endometrium	Endometrium	62Y	Adult	Female	Japanese	Endometrial adenocarcinoma	no available	cell	JHUEM2	curated
JHUEM-3	JHUEM-3	CVCL_4657	no available	Homo Sapiens	Endometrium	Endometrium	60Y	Adult	Female	Japanese	Endometrial adenocarcinoma	no available	cell	JHUEM3	curated
JHUEM-7	JHUEM-7	CVCL_4658	no available	Homo Sapiens	Endometrium	Endometrium	58Y	Adult	Female	Japanese	Endometrial adenocarcinoma	no available	cell	JHUEM7	curated
PCM6	PCM6	CVCL_4666	no available	Homo Sapiens	Blood	Peripheral blood	60Y	Adult	Female	Japanese	Plasma cell myeloma	no available	cell	PCM-6	curated
PK-1	PK-1	CVCL_4717	PK-1 cell	Homo Sapiens	Pancreas	Liver	no available	no available	no available	Japanese	Pancreatic ductal adenocarcinoma	no available	cell	PK1	curated
PK-8	PK-8	CVCL_4718	PK-8 cell	Homo Sapiens	Pancreas	Liver	no available	no available	no available	Japanese	Pancreatic ductal adenocarcinoma	no available	cell	PK8	curated
MDA-PCa-2a	MDA-PCa-2a	CVCL_4747	no available	Homo Sapiens	Prostate	Bone	63Y	Adult	Male	African American	Prostate carcinoma	no available	cell	MDA PCA 2A; M.D. ANDERSON-PROSTATE CANCER-2A; MDAPC2A; MDA2A	curated
MDA-PCa-2b	MDA-PCa-2b	CVCL_4748	MDA-PCa-2b cell	Homo Sapiens	Prostate	Bone	63Y	Adult	Male	African American	Prostate carcinoma	no available	cell	MDA PCA 2B CELL; MDAPCA2B; MDAPC2B; MDA2B; MDAPCA-2B; MDA PCA 2B; M.D. ANDERSON-PROSTATE CANCER-2B	curated
U-343-MGa	U-343MGa	CVCL_4773	U-343MG-A cell	Homo Sapiens	Brain	Temporal lobe	64Y	Adult	Male	Caucasian	Glioblastoma	no available	cell	U343; U-343-MG-A CELL; U343 MGA; U-343 MGA; U-343 MG-A; U-343 CELL; U343 CELL; U-343 MG-A CELL; U343 MG-A CELL; U343MGA; U343-MG-A CELL; U-343-MG-A; U343-MG-A	curated
HuG1	HuG-1	CVCL_4845	no available	Homo Sapiens	Stomach	Ascites	55Y	Adult	Male	Japanese	Gastric tubular adenocarcinoma	no available	cell	HUG	curated
HuG1-N	HuG1-N	CVCL_4846	no available	Homo Sapiens	Stomach	Ascites	55Y	Adult	Male	Japanese	Gastric tubular adenocarcinoma	no available	cell	HUG-1N; HUG1N	curated
HuG1-PI	HuG1-PI	CVCL_4847	no available	Homo Sapiens	Stomach	Ascites	55Y	Adult	Male	Japanese	Gastric tubular adenocarcinoma	no available	cell	HuG1-PI	curated
LMSU	LMSU	CVCL_4849	no available	Homo Sapiens	Stomach	Lymph node	27Y	Adult	Female	Japanese	Gastric carcinoma	no available	cell	LMSU	curated
RBE	RBE	CVCL_4896	no available	Homo Sapiens	Biliary Tract	Liver	64Y	Adult	Female	Japanese	Intrahepatic cholangiocarcinoma	no available	cell	RBE	curated
PK-59	PK-59	CVCL_4897	PK-59 cell	Homo Sapiens	Pancreas	Liver	66Y	Elderly	no available	Japanese	Pancreatic carcinoma	no available	cell	PK59 CELL; PK59	curated
Sq-1	Sq-1	CVCL_4900	no available	Homo Sapiens	Lung	no available	no available	no available	no available	Japanese	Squamous cell lung carcinoma	no available	cell	SQ1; SQ-1	curated
SSP-25	SSP-25	CVCL_4902	no available	Homo Sapiens	Biliary Tract	Ascites	61Y	Adult	Female	Japanese	Intrahepatic cholangiocarcinoma	no available	cell	SSP25	curated
MHCC97-H	MHCC97-H	CVCL_4972	MHCC97-H cell	Homo Sapiens	no available	no available	39Y	Adult	Male	Chinese	Adult hepatocellular carcinoma	no available	cell	MHCC-97H; MHCC 97-H; MHCC97H CELL; MHCC97H; MHCC-97H CELL; MHCC 97-H CELL	curated
MHCC97-L	MHCC97-L	CVCL_4973	MHCC97-L cell	Homo Sapiens	no available	no available	39Y	Adult	Male	Chinese	Adult hepatocellular carcinoma	no available	cell	MHCC-97L CELL; MHCC97L; MHCC 97-L CELL; MHCC97LCELL; MHCC 97-L	curated
U-CH2	U-CH2	CVCL_4989	no available	Homo Sapiens	Bone	Sacral bone	72Y	Elderly	Female	Caucasian	Sacral chordoma	no available	cell	UCH-2; UCH2	curated
MS751	MS751	CVCL_4996	no available	Homo Sapiens	Cervix	Lymph node	47Y	Adult	Female	Caucasian	Human papillomavirus-related squamous cell carcinoma	no available	cell	MS-751; MS 751	curated
MP46	MP46	CVCL_4D13	no available	Homo Sapiens	Eye	Uvea	69Y	Elderly	no available	no available	Uveal melanoma	no available	cell	MP46	curated
SKG-I-TS	SKG-I/TS	CVCL_4J75	no available	Homo Sapiens	Cervix	Cervix	40Y	Adult	Female	Japanese	Human papillomavirus-related squamous cell carcinoma	no available	cell	SKG-I-TS	curated
SKG-II-LUC	SKG-II/LUC	CVCL_4J76	no available	Homo Sapiens	Cervix	Cervix	50Y	Adult	Female	Japanese	Human papillomavirus-related squamous cell carcinoma	no available	cell	SKG-II/LUCIFERASE; SKG-II-LUC	curated
SKG-II-TS	SKG-II/TS	CVCL_4J77	no available	Homo Sapiens	Cervix	Cervix	50Y	Adult	Female	Japanese	Human papillomavirus-related squamous cell carcinoma	no available	cell	SKG-II-TS	curated
